Post ID,Comment ID,Comment Text,Comment Level
176v84r,k4qpt40,"Portal fantasies have been popular in media for a powerful long time.

Isekai in anime has similarly been around for a long time, even if that particular term hadn't yet been coined. Orguss, Wataru, Dunbine, Leda, Rayearth, Fushigi Yuugi, Escaflowne, Digimon, and so on.",1
176v84r,k4qt0ig,"Sword Art Online started it, and there were also the Mushoku Tensei novels which were really influential and codified some of the tropes associated with modern isekai. the Web Novel scene heavily influenced how it developed, and the first few major adaptations made a big splash and inspired producers to go obsessively hunting for the next big thing, or at least something that could turn a quick profit. I think that the secret to the longevity of a boom like this is starting with a few quality tentpoles, and then the garbage pours in. In this case I feel like Konosuba, Overlord, and Re:Zero were that in terms of anime. Though I'm not entirely sure when generic power fantasy became more common than more novel concepts or takes on the basic story. I guess it was just inevitable that it'd get flattened out into the most boring, least common denominator version of itself? There's also sort of the 'meta' in terms of one-upmanship in wacky premises, with different professions, non-traditional aspirations, and being reincarnated as something other than human being the primary ways of differentiation. 

At this point isekai has carved such a niche that it doesn't have to remotely try anymore. You saw people insisting that one Isekai Cheat Skill show was good entertainment despite it being aggressively fatphobic, shallow, unpleasant trash with storytelling that basically amounted to a series of 'and everyone clapped'. Like, the average trash web novel writer is still capable of writing actual characters and a semi-coherent, if not good story, but we're at the point now where a property so fundamentally broken in terms of characters, story, themes, and direction is slurped up by people. even more than that, people had no excuse when Kamikatsu was airing that season (at least that did find an audience). It seems like people conditioned towards isekai trend towards worse and worse taste until they have no palate whatsoever, though. I don't think it was isekai trash people who really appreciated how uniquely batshit Kamikatsu was.",1
176v84r,k4qh2fz,"I know right ?, It’s kind of funny-sas how the genre exploded in popularity just to collapse on itself with copy/paste plots :(",1
176v84r,k4qhkc5,Showa Genroku Rakugo Shinju sounds like something you'd enjoy,1
176v84r,k4q9ewl,"Yona is a great series but there is a lot of manga that hasn't been animated. I think the series covers up to about vol 7. There's also an OVA or three which cover a couple of later chapters, but I think vol 42 just came out in Japan so...it depends if that's an issue for you. I 100% recommend the manga, but I get that sometimes people have issues with incomplete adaptations. STILL hoping for a season 2 one day, eventually...",1
176v84r,k4qxu3e,"Yuki Yuna is a Hero, it's a magical girl anime that has a similar dark tone as Madoka Magica but in my opinion it's better. 

Great Pretender, it's a netflix original anime about con artists that only con bad guys. The artstyle is so beautiful to look at. 

Sk8 the infinity, a nice and short sports anime about skateboarding. The characters are very entertaining and it makes skateboarding look a lot funner than real life. 

Inuyasha, a perfect mix between shonen and romance. It's about a girl who was reincarnated 500 years in the future, she travels back in time to when her first incarnation was alive and meets Inuyasha, a half demon who was her first incarnations true love. The humor is a bit outdated since it's kind of an old anime but it's still has very good writing ahead of it's time.",1
176v84r,k4s9l2b,"I guess depends on why you didn't like CSM. CSM is on par with AOT in terms of being serious (CSM is actually more fatalistic with it's characters than early AOT). It does actually feel quite put together (at least Part 1 haven't gotten into 2 yet) especially in regards to the overall themes Fuji is going for. That said it's still basically a cheap B movie horror action story (like Evil Dead or something). That is what it is going for. 

**Serious shows that I think have a lot bishonen esque characters that appeal to a shojo fanbase**

- Moriarty the Patriot - Sherlock if written like Death Note with bishonen male characters.

- The Case Study of Vantias - Like the above shonen manga with attractive bishonen male leads. Does have some chibi humour that might detract from the ""seriousness"" but it's still a pretty good action low fantasy story about fighting vampires that can be serious. Vanitas is one of the better bishe designs I have seen in the medium personally. 

- Mobile Suit Gundam Iron Blood Orphans - Largely serious tone with a big male cast. You don't need any past experience with Gundam to enjoy it  as it's a standalone AU story

- Legend of the Galactic Heroes - Watch the first two prequel films My Conquest is A Sea of Stars and Overture to a New War and skip the first two episodes of the main series after seeing the films. Overture covers the first two episodes better. Extra content you can watch after the fact is the prequel Gaiden and the remake **if you are okay with something older Reinhard is up there as bishonen excellence. Remake while I think is inferior (due to smaller nit pick reasons) does have more modern designs granted you will be waiting for them to adapt it all**

- Banana Fish - If you haven't this. I would check it out. It's actually shojo but a pretty good serious action crime thriller with bishonen men. 

**Other shows I would recomend that are quite serious in tone but may not meet the bishonen requirement**

- Monster - the best crime drama in the medium in my opinion. Way more grounded than Death Note and slower but really good at especially writing side characters. If you end up liking it I would check out the upcoming Pluto which is also by Urasawa.

- Parasyte the Maxim - Has a lot of the body horror elements you might be interested in from CSM. Shinichi as an MC feels kinda like body horror Peter Parker  aka wimpy nerd becomes action hero after getting powers. 

- Showa Genroku Rakugo Shinju - Josei manga and a very good serious drama. 

- Ghost in the Shell Films and Stand Alone Complex - Sci Fi Classic for a reason. 

- Vinland Saga - Very good historical drama. Canute is a bishonen at the beginning lol but kinda loses that as he gets older. 

- Cyberpunk Edgerunners - Early David I guess could qualify but besides that generally good take on the dark action cyberpunk setting and a good adaption of the TTRPG and game. Watch the dub more immersive.

- March Comes in Like a Lion - Very good drama tackles the topic of depression quite well and many other serious life topics. Mangaka is a former Josei mangaka (Honey and Clover which is good too) though March is seinen. 

- Moribito - Guardian of the Spirit - Very good low fantasy action series. Balsa is one of the cooler action female leads in the medium. 

- Texhnolyze - If you want something incredibly nihilistic and depressing Texhnolyze has got you covered.",1
176v84r,k4s5xrg,"Chainsaw Man gets pretty good, I didn't like it at the start.  There's a certain scene where everyone describes it as ""where chainsaw man really starts"", and then another scene tops that lol. Consider giving it another chance.

I recently watched Inuyashiki, it's kind of similar to death note in a way.

An anime with good story, I would say Made in Abyss, it's pretty messed up but really good. Make sure you watch the movie in between season 1 and 2 though.

Erased also has a really good story, one of my favourite animes.",1
176v84r,k4pr7fv,Fwiw Gintama doesn't have any arcs longer than 50 episodes. It's mostly episodic comedy and the serious arcs are usually less than 10 episodes except for the Silver Soul arc which is the last one.,1
176v84r,k4pswc3,"Taking that full list and eliminating everything you've decided against leaves only 8 things: Black Clover, D.Gray-man, Fairy Tail, Katekyou Hitman Reborn, Pokémon, Toriko, World Trigger, Yuu Yuu Hakusho.

If you really have no preferences, [pick at random](https://rolladie.net/roll-a-d8-die) and go with the number it gives you.",1
176v84r,k4ptntu,"> ive also decided aganst hajime no ippo,monster and space brothers as they arent split into arcs

People usually don't do it because it's not that long, but Monster *can* be split into arcs. There are guides.",1
176v84r,k4sdo16,"I think this is the first time I've heard someone call Sasuke ""chill"". The dude is constantly on edge and can't get along with anyone. Naruto is more ""chill"" than Sasuke imo.",1
176v84r,k4s59v9,"No point dissecting someones personal preferences. People are different and have different opinions on things. I like JJK, some people don't, that's fine.",1
176v84r,k4ps4ay,">So I have a question why do the majority of modern or general anime series often feature romance as a prominent theme? 

Most entertainment has a romance element because falling in love and getting together with someone is an important part of a happy life for a lot of people. Seeing the protagonist get a boo reinforces their triumph and happy ending for the audience. It's a common story component because it's a common experience.",1
176v84r,k4pqfnz,"> So I have a question why do the majority of modern or general anime series often feature romance as a prominent theme? 

They do? Out of 12 non-romcom/romances/yuri-as-main-appeal shows I've watched this season, only two have any romance in them.",1
176v84r,k4porz2,"I'm always of the mind that good romance can make any show better!

I don't feel like there's been any change lately in non-romance shows on my end and I would say sadly to that haha",1
176v84r,k4pu6po,"One of the reasons I still watch anime is that I can find series which don't have romance in them. Every major movie and TV series I can think of has a romantic relationship as a key plot point or a character goal. 

Meanwhile, in anime we have chill series like Yuru Camp, Non Non Biyori, Mitsuboshi Colors, etc. which are as aromantic as you can get. That being said, romance is a big thing in art because it is a big life goal for people around the world and it dominates a lot of people's mindspace. It's not a surprise to me that it's omnipresent in places where you wouldn't expect it.

As an incidental point, another reason I've stuck with anime is that it's one of the few outlets of ""low conflict"" series. It's hard to find any media that doesn't ratchet up the tension in some way, either in a physical way like in battle shounens, or in the context of social situations like you see in dramas.",1
176v84r,k4ps2f3,"at best, maybe 33% of anime have even a whiff of romance; be better about filtering what you watch

and you say this as if there isn't a single type of media that doesn't have examples of romance shunted in there...",1
176v84r,k4pb0e8,"I don't know about the song, but the characters are from [Shachiku-san](https://myanimelist.net/anime/49160/Shachiku-san_wa_Youjo_Yuurei_ni_Iyasaretai), the specific picture is [from the opening](https://i.imgur.com/K2ew2Z6.png)",1
176v84r,k4qpilt,"Tubi TV and Pluto TV, and there are Youtube channels like GundamInfo, Viz and Nozomi Entertainment. Amazon Freevee has a few anime series too.",1
176v84r,k4sdx95,Random peoples yt channels have it,1
176v84r,k4r3i7f,"* [Cheat Skill](https://myanimelist.net/anime/52830/Isekai_de_Cheat_Skill_wo_Te_ni_Shita_Ore_wa_Genjitsu_Sekai_wo_mo_Musou_Suru__Level_Up_wa_Jinsei_wo_Kaeta)
* [Summoned to Another World for a Second Time](https://myanimelist.net/anime/50220/Isekai_Shoukan_wa_Nidome_desu)
* [Classroom for Heroes](https://myanimelist.net/anime/49894/Eiyuu_Kyoushitsu)
* [Kamikatsu](https://myanimelist.net/anime/50220/Isekai_Shoukan_wa_Nidome_desu) if you count being smarter than everyone as OP.",1
176v84r,k4s0qvp,My Unique Skill Makes Me OP Even at Level 1,1
176v84r,k4rlu6m,"Frieren is my favourite so far and it's not remotely close. Looks stunning, beautiful music, and a very slow and contemplative atmosphere.

Since you liked horsegirls, the new season should be worth checking.",1
176v84r,k4rnxx7,"Frieren is the most popular non-sequel and for good reason. Has a melancholic fantasy story that works a lot with the different perception of time elves have due to their lifespans, but where it really shines is because of its production. When it comes to visuals and sound design it's easily the most impressive show this season for me.

Stardust Telepath had a nice start too. If you like Kirara cgdct shows and/or anxious protagonists it's pretty much a no-brainer to pick up.

I'm In Love With the Villainess isn't the best-looking show around, but it makes up for it by being extremely gay with a fun dynamic for the main couple. The protagonist tries to do everything in her power so she can date and/or be bullied by the villainess of the otome game she was transported into.",1
176v84r,k4s0bef,[My opinion](https://www.reddit.com/r/anime/comments/175adhi/comment/k4eg0p7/),1
176v84r,k4s2b6d,"[My Fall 2023 rankings so far for non-drops.](https://i.imgur.com/GzkuMyq.png) Anything with one-episode could easily shift this weekend, plus two of the hyped ones aren't out yet (Apothecary Diaries on Oct. 21, Pluto on Oct. 26). Haven't touched most sequels yet.",1
176v84r,k4s46da,"Frieren's also my top pick; great animation, story, character, attention to detail, etc.

These other ones depend on your preferences: 

* 100 Girlfriends &mdash; harem comedy; seems like it's primarily a meta-comedy with dedication to ""the bit""; lots of energy and larger-than-life characterization
* Yuzuki Family's Four Sons &mdash; drama slice-of-life; found the first two episodes pretty relatable for conflict in sibling relationships; an emotional but wholesome series so far",1
176v84r,k4t6d37,"Frieren, 100 Girlfriends, Shy, Undead Unluck, I'm in Love with the Villainess, Tearmoon Empire, 16bit Sensation.

I wouldn't necessarily recommend binging Ancient Magus Bride if you're not current on it just to keep up with the current arc, but it's cooking pretty nicely now. its brand of fantasy hits different from anything else. The Eminence in Shadow is also airing its second season, and the first is great as long as you give it about three episodes to reveal what it actually is. Dead Mount Death Play started in the spring of this year, took a break over summer, and is back. It's not got the best production values, but it's a very funny show that sneakily disguises itself as an edgy urban fantasy/crime show. and then it introduces PHANTOM SOLITAIRE and really tips its hand that it's a goof. or maybe the ghost occupying a shark plush already indicated that?",1
176v84r,k4te9si,"I've been rewatching Spy x Family's English dub on Hulu, and the subtitles match up perfectly so far. I only saw the most recent episode subbed, and as far as I can tell (for someone who doesn't speak Japanese, but is familiar with the manga dialogue) the subs are good.",1
176v84r,k4rj2pn,"Yeah, in hindsight I probably could have waited on Demon Girl but then I wouldn't have hit free shipping with this order, and there's no guarantee that Demon Girl would be even cheaper on black friday anyway.",2
176v84r,k4rlq2s,"I think the steelbook sold through its run and is no longer available. Looks like Sentai isn't even offering it at all, let alone on sale, any more.",2
176v84r,k4rk2k6,"To be fair, $10 for School Live is still a hell of a deal and totally worth it IMO.",2
176v84r,k4sc8t1,I hate Shield Hero as much as the next guy but we aren’t even talking about S2 here 😭,2
176v84r,k4qpsdl,"That's embarrassing, but that's what happens anytime Kaguya is in the running.",2
176v84r,k4qfp3p,"It's just wild to me that this generational shoujo that has, I suspect, resurrected shoujo anime and has a rewatch already didn't rate in the top 10 for that year. Like, who is making Dragon Maid their personality? Nobody. Who is still talking about Dynazenon? Pretty much no one. Who can remember anything about Vivy? Not me. It is the most baffling awards decision, public or jury, and I will die mad about it.",2
176v84r,k4r32w2,"Using that same line of thinking it's not hard for me to see why someone wouldn't vibe with any anime.  I didn't vibe at all with Heike Monogatari or Sonny Boy (I dropped both of them).  But I recognized that there was a quality in them that made them Anime of the Year worthy just like there was with Fruits Basket.  I was much more upset with the other 3 being nominated by the Jury over Fruits Basket (Dragon Maid, Non Non Biyori and Dynazenon).",2
176v84r,k4t9vqp,"
> Giving the pig isekai another episode as it wasn't clear where it's going

I always find these sorts of shows tricky, because people often write them off very quickly and they're often right to do so, especially in terms of the flavor being wrong for their tastes even if the content turns out to be notably different from what they initially judged a show for.

This is often the case even when the show is dropping unambiguous hints that something else is going on, like *Love Flops* did. If people don't like the surface content, they're unlikely to want to sit through that just to get whatever else was being offered up.

I feel like the main exception to this is when something has achieved ""classic"" or ""appreciation by serious viewers"" status, like *Neon Genesis Evangelion* (not saying *ButaReba* or *Love Flops* are on that level, but NGE is chockfull of stuff that many viewers would not tolerate in any seasonal).

> [ButaReba]

My main favorite bit along those lines is that the MC openly wondered about the possible premise of the show - pondering if he was a pig on the inside as well as a pig on the outside. 

However I'm fairly certain that whatever *ButaReba* has cooking, it's not going to be enough for people who hated the MC's degenerate monologue to sit through it to get to the other stuff.

In a way, that's probably a good thing for everyone!",2
176v84r,k4r1n29,"It's hard to imagine what would incentivize treating their animators better... besides giving a shit about them, which hasn't seemed to be something they've been doing so far. I mean they're making so much money and it's hard to imagine people boycotting their anime. Even if Japanese animators and other staff refused to work with them, they could just continue outsourcing, right?",2
176v84r,k4qzlbf,That's hilarious. Figured it be a lot but not that much. Thanks for sharing.,2
176v84r,k4p7ack,So he's spoiling the basket of fruit by adding a piece of chalk to it while Machi watches on helplessly.,2
176v84r,k4pmb1i,[](#csikon),2
176v84r,k4pkfjr,You and u/raichudoggy *did* come first to mind if I'm honest (haha).,2
176v84r,k4qzwsj,Yes! Another good example!,2
176v84r,k4qirhi,Oh thanks you. I have seen shield hero. Have to check others,2
176v84r,k4qit95,Seen it. It was good anime,2
176v84r,k4sxyq4,Watched it. It was fun. Waiting for s2,2
176v84r,k4sqj9e,ohh thanks!,2
176v84r,k4pzmbl,Rumbling Hearts is KGNE,2
176v84r,k4sopf6,"Maybe so, but it just wasn't the vibe I was looking for, I'll have to wait till I'm in a better mood :)",2
176v84r,k4sb6yg,"Is it well animated?

I feel like the edgy thing is more of a source material problem instead of coming from its adaptation.",2
176v84r,k4snaul,"So that means there are shows that are edgy, misogynistic but somehow not garbage?",2
176v84r,k4qapte,"Thank you! It makes me happy knowing someone enjoyed reading my ramblings!

If it's any consolation to HiDive I don't live in a country covered by their services. But yeah, even if I did, this season I'm definitely a Crunchyroll guy. Nowadays it's difficult not being a Crunchyroll guy.",2
176v84r,k4qm7sf,"Well, I only saw the first episodes, but I think that they definitely have a similar ""style"" and in that I think they work very well. Maybe Eminence was a little more on the comical side than Ragna, but both felt very strong in their genre.

Still, personally speaking I am a guy who enjoy cheerful stories with lots of comedy and cute moments. So when it comes to serious shows with a dark setting especially like Ragna I simply don't know how to appreciate them.",2
176v84r,k4qnq97,Anything within 10 years is recent,2
176v84r,k4qhbi6,"Ok, so maybe that last part is false, but my god the genre is everywhere as there are 100s of anime series that are isekai themed.",2
176v84r,k4quptq,"> Though I'm not entirely sure when generic power fantasy became more common than more novel concepts or takes on the basic story

Like, mid-to-late 00s. The generic power fantasy was always the more common take on the story in the web novel scene.",2
176v84r,k4sclcn,I did watch erased and I did like it! ok i will continue chainsaw man and see where that goes and I’ll look into your other recommendations thank you! I’m just getting old I can only relate so much to 15 yo characters lol,2
176v84r,k4preth,"Thanks for this, another reason why chat gpt cannot be trusted (I asked chat gpt cuz if I looked up an arc list some of the arc names may be spoilers)",2
176v84r,k4pt7i4,"Thats a smart idea idk why I never thought of it, I guess I'd kinda like control but I spoke it doesn't matter

Also in regards to gintama as I said to a different commentor I used ai and it made a mistake",2
176v84r,k4ptvqu,Ya ig I'd also kinda like to watch monster in one go and if its not clear where one arc ends and one begins its not really all too fun,2
176v84r,k4s5c9x,Fair,2
176v84r,k4pqr0o,[deleted],2
176v84r,k4pslq5,[deleted],2
176v84r,k4pf8av,I can hear the squelching noises and none of their feet are even on the ground!,2
176v84r,k4t6h7l,"Kamikatsu is the Sigma Male power fantasy, lol",2
176v84r,k4som9d,Bean sprouts and carrots are surprisingly versatile!,2
176v84r,k4rwjc8,"That's too bad. I have a few of Sentai's steelbooks and they're all good quality for the sales prices you can get them. The only other set I think is worth pointing out is the Patlabor Ultimate Collection. It's $70 which is a lot more than the ones you pointed out but it's literally all of the Patlabor anime. Early Day OVAs, all 3 movies, the TV anime, and the TV anime OVA sequel, even the chibi OVAs. The only thing it's missing is the 2016 Japan Animator Expo short. I've been saying for a while that it's Sentai's best deal even for the MSRP.",3
176v84r,k4rm8r6,"It definitely is, I'm just lame, lol. I'm still thinking about it, I'd love to own physical media for all the shows I like but it's also hard to justify it given that I basically never actually use my BDs for their intended purpose. I'd definitely spend 5 bucks for a glorified collectors item, 10 bucks I'm less sure of.",3
176v84r,k4qqnqz,"> Who can remember anything about Vivy?

Vivy actually became one of my favorite sci-fi anime, so for me, the story was very memorable. I'm also more a fan of the sci-fi genre than drama though.",3
176v84r,k4sak0v,"> Who can remember anything about Vivy? 

I mean I do and I actually think it's still a very good intro anime due to it's straight forward sci fi plot with good production values and largely being satisfying. Modern Sci Fi anime being quite rare gets it to stand out more.",3
176v84r,k4r5xxg,Non Non Biyori is absolutely in that top tier for me personally.,3
176v84r,k4rd8d6,"Because my point is that jurors are just like other people, persons with they're own opinion and tastes. Yes they can recognize when a show has good things to them, but they won't prioritize it over something that has good thing and they actually like.

Back to FB, I do think it has some good themes and messaging as well as some rewarding character journeys and arcs. Some people say it shifted their whole worldview and got them through tough times. That's a good thing!

But at the moment of truth, it doesn't make it less than chore to me. I still don't like Tohru on-screen, like 3/5 eps have me bored, the drama in S3 is so over the top it was hilarious and the only reason I rated it positively is because I enjoyed in the same way one would enjoy a mexican telenovela. 

Just because I recognize that the show has positive attributes, I won't gaslight myself and go 'Ok, I hated watching this but...its a symbolic shoujo guys! 10/10'. If I was in AOTY it would have been my stance that yeah, it has good things but I would rather nominate other shows.

I may try to go for AOTY this year and if I get in I can already see with my third eye being in the results thread and be like ""Yes guys, I very unironically think this CGI cute girls band drama is better than Vinland S2 and JJK"".",3
176v84r,k4r3xji,"I don't know wether thats the case with jjk, but often the studioes themselves ddon't really get much of that money due to th ecommitee system. For example, ufotable didn't really make a ton of money with demon slayer. And of course, then they also aren't really incentivized to make sure the product is perfect. The system is broken.",3
176v84r,k4pnge1,"Well, I knew it was coming. I knew one of the mods (not Gap or Biscuits) had a this is the place picture in mind a short time after I announced the rewatch and they told me this, but I have long forgotten which one and which thread they told me it in.

With how long they took, I was almost worried they’d forgotten altogether. Was expecting a season 1 picture!",3
176v84r,k4q0s99,"Oh, I didn't immediately recognize the shortening without the full words.",3
