Post ID,Comment ID,Comment Text,Comment Level
1777dpc,k4r5gku,Ouch,0
1777dpc,k4rgib2,Is there a sub for dark punchline jokes?,0
1777dpc,k4r8jat,Holy crap,0
1777dpc,k4rv26n,"95 year old woman in a small town calls the funeral home. 

“I want you to bury my husband.”

The funeral director recognized the voice so he says “Mrs. Jones, didn’t we bury your husband 10 years ago?”

“It’s Mrs. Green now. I remarried.”

“Well, congratulations!”",0
1777dpc,k4raagz,Hate will keep you alive a lot longer than love will...,0
1777dpc,k4rgeep,Wft... that's not a joke. Just sad all around.,0
1777dpc,k4rec2m,"""The baby just retired!""",0
1777dpc,k4retpf,That took a dark turn from what I expected..,0
1777dpc,k4sebx3,"A 95-year-old woman goes before a judge for throwing her husband out a window.

The judge says, “You’ve been married for over 70 years. Why in the world would you throw your husband out the window?“

The woman responds, “He came home and said that he had had an affair. I figured if he could have an affair at his age, he could fly!“",0
1777dpc,k4rsblx,Now I'm worried. My parents are in their 90s. I might not outlive them!,0
1777dpc,k4rhdlv,"Congrats, maybe I have unusual tastes but this made me laugh harder than anything else in this sub for a long time",0
1777dpc,k4rjfu8,Where is the joke?,0
1777dpc,k4rl517,Hits home. My 85 year old mom just filed for divorce from my 85 year old stepdad after 45 years together. And yes they hate each other and have for quite some time.,0
1777dpc,k4re5zs,"I feel like this either isn’t really a joke, or it’s a really really forced joke.",0
1777dpc,k4rp0v0,r/Unexpected,0
1777dpc,k4rsykh,My parents story,0
1777dpc,k4rv52a,We were arguing who would get custody of the dog.,0
1777dpc,k4s1tnu,So I see you know my parents,0
1777dpc,k4s3xik,"I remember this joke from night court in the 80's, and I quote it all the time",0
1777dpc,k4rj8qq,I liked it and found it funny,0
1777dpc,k4rmq6u,"I thought this was pretty funny.

But I thrive on dark humor",0
1777dpc,k4rrlsm,"Then the couple return home. The man had had the remote and was switching back and forth between a fishing channel and the porn channel. 

The old woman became more and more annoyed and finally said, ""For God's sake... leave it on the porn channel... you know how to fish!""",0
1777dpc,k4rhroi,"""...also, why did you hire just one lawyer for your divorce? I'm gonna get disbarred for this shit!""",0
1777dpc,k4rymc3,Christ that’s dark. Have an upvote,0
1777dpc,k4ruae9,"So, I guess if you have to explain a joke, that means it does not work, but...

The idea here is a surprise.  You expect them to say something more like ""we were waiting for the children to leave home"" or a similar motivation, but ""waiting for the children to die"" is supposed to surprise you, and also be a commentary on how incredibly old they are.",0
1777dpc,k4rpvmm,Where's the funny!,0
1777dpc,k4rkduv,Holy crap that was dark,0
1777dpc,k4rrjq2,This is great! I’ve never heard this one before so kudos to OP for something original.,0
1777dpc,k4s1l3i,I like it.,0
1777dpc,k4s1pzs,I thought it was a pretty good read.  I feel exactly the same as this couple feels.  Maybe if I get a divorce at 95 I can die happy,0
1777dpc,k4s5ep9,This joke is older than their youngest child,0
1777dpc,k4s8o5j,oh shit,0
1777dpc,k4sqx8h,My wife hated this joke and laughed.,0
1777dpc,k4rigsc,Nice!,0
1777dpc,k4rl3ww,Hahahaha.  Noice,0
1777dpc,k4rhj8a,Interesting dark punchline. However not so funny though.,0
1777dpc,k4r8mwu,It should be in wholesomememes sub or something.,0
1777dpc,k4rqjhz,Oof,0
1777dpc,k4sftw7,*yawn*,0
1777dpc,k4slvyb,This is so fucking stupid. Why is this a default sub,0
1777dpc,k4s7hra,Funny?  Not ....sorry,0
1777dpc,k4s1efl,Been there :),0
1777dpc,k4su82l,It's weird how this sub has so many morbid jokes but this is the one everyone decides to feel sad over,0
1777dpc,k4suh13,"I like joke but I can't ""see"" why?",0
1777dpc,k4t2tda,"Love this joke.  

Laurie Anderson tells a great version of it on 
""Another Day in America.""

Well... we wanted to wait until the children... died.",0
1777dpc,k4t52dx,Jesus christ,0
1777dpc,k4t9v11,Oh. My. Gosh.,0
1777dpc,k4s10qb,Tough as it took them 50 years to conceive.,1
1777dpc,k4soqb9,Did my machete poke you dear? Camp counselor by chance?,1
1777dpc,k4rh3ii,This morning u/NXGZ introduced a lot of us to a sub dedicated to foreskin that is too tight……I’m pretty sure there’s a sub for dark jokes.,1
1777dpc,k4ri04u,"You know, dark humor is like food in North Korea.

Not everyone gets it.",1
1777dpc,k4sb7ob,Try r/darkjokes,1
1777dpc,k4t06x7,There was dark humor but it got shut down,1
1777dpc,k4sqnf4,"Used to be a r/ImGoingToHellForThis, but certainly not mainly joke content.",1
1777dpc,k4sbbwz,Yes but it would need a punchline.,1
1777dpc,k4s6vnc,I don't understand this joke,1
1777dpc,k4sa63q,This one is better.,1
1777dpc,k4rqp6a,Such is the way of the dark side...,1
1777dpc,k4rjans,Humans will survive things out of sheer spite.,1
1777dpc,k4ryzf5,TIL I am immortal.,1
1777dpc,k4rjc31,Humans will survive things out of sheer spite.,1
1777dpc,k4rxxjc,It’s just a joke. It’s not real.,1
1777dpc,k4sqhen,It’s just a joke man no need to get so broken up about it,1
1777dpc,k4s2aoh,I live with mine (I'm 60) so they don't have to go to assisted living.  I take care of everything including their finances (got them out of a $16000 hole arguing with a credit card company).  My mom hates it when she says she worries about me being alone when they're gone and I reply 'I just have to outlive you'.  I think it's funny as hell personally.,1
1777dpc,k4sp33i,If King Charles III can do it so can you.,1
1777dpc,k4s2tqr,"same, saving this for Christmas",1
1777dpc,k4s3cht,Glad you liked it.  It's a personal favorite.,1
1777dpc,k4riz0g,"Why? It isn't even a good punchline. Like, what is this a play on? Where is the humor supposedly found? It's just edgy and shocking for the sake of it, but it makes no sense as a joke.",1
1777dpc,k4rvvdw,It's a play on waiting for the kids to leave home.,1
1777dpc,k4s4lt6,I guess they just got tired of waiting for you to die…you ungrateful little shit!,1
1777dpc,k4s9xra,"Yeah my parents divorced after 52 years of marriage. All 4 kids were like “I can’t believe it lasted that long!”  (Proud of you, mom)",1
1777dpc,k4sm6kx,Did you ever talk to either of them and did they ever explain their feelings or anything about the late stage divorce,1
1777dpc,k4sjy4e,"It's a poor version of the joke and the success of it lies in the telling/delivery. 

The backstory about their misery doesn't add to the joke.

A 90 year old couple goes to a lawyer and says they'd like a divorce. He asks them how long they've been married, '70 years' they reply. 'That's a long time to be married, why do you want to get divorced all of a sudden?' 'Well, we talked it over and we decided it would be best if we waited until the children died.'

This version leaves out the irrelevant details about their hatred. It focuses on their over concern for their kids' emotional health to the point of absurdity.",1
1777dpc,k4rv7rx,"I’ve heard it before. It’s a joke with seniority, if you will.",1
1777dpc,k4sb56c,"The punchline just isn't very clever. It might work as a mix of deadpan and dark humor when properly told in person, but it's pretty hit-and-miss in written form.",1
1777dpc,k4rxq6d,I think this joke would go down well in retirement homes.,1
1777dpc,k4s2hwu,it's the best humor.. that and perverted humor,1
1777dpc,k4s13cd,Nope; actually more common than most people know.,1
1777dpc,k4smgl3,If things are amicable at least in terms of Separation one lawyer is enough I take it,1
1777dpc,k4s3q4t,How is “waiting for the children to leave the house” not funnier?  It’s a better commentary on our current society.,1
1777dpc,k4ryaw6,"Don't listen to the naysayers. Humor is subjective. Not everyone will find everything to be funny.

I thought it was funny. I saw what you did there and I appreciate it, even if many others do not.

BTW, it's also a commentary on how committed to their kids they were.",1
1777dpc,k4rvjdn,"The problem is that while you did succeed in being surprising, the surprise wasn't particularly funny. It just felt kinda random, and while some people might find that funny I don't think most do.",1
1777dpc,k4slj1h,If people don’t think your joke is funny they can just move on. Not everyone thinks everyone else’s jokes are funny. Some of my jokes make some people laugh and others just roll their eyes. I mostly remember the laughter.,1
1777dpc,k4s3isk,"I didn't invent it. I think it was a Buddy Hackett joke that he told on the Tonight Show, but I won't swear to it.  Anyway, it's one of my favorite jokes.",1
1777dpc,k4smuen,"You're 95... now an oldman lying is bed dying when you smelled your favorite cookies. You roll out of bed and crawl into the kitchen. Then you pick up a cookie with all of your remaining strength but....

The wife smacks it out of your hand with the spatula and says, ""what are you doin? Those are for the funeral...""",1
1777dpc,k4sb5mx,Or more likely they conceived in their 20s and most of their kids were at least 60 when they died. Very few 68 year old women conceive children.,2
1777dpc,k4rhq1d,So you were there as well,2
1777dpc,k4teo72,... link?,2
1777dpc,k4spqfu,"Hey, that’s not fair. I asked my friend in North Korea how he was doing today. He said he can’t complain.",2
1777dpc,k4spdka,"my method of telling a joke is similar to the north korean method


laugh or i execute your family",2
1777dpc,k4seui4,North Korea doesn’t need a punchline. They just punch black and white people in the face.,2
1777dpc,k4s8iu3,She got remarried and her new husband also died and he congratulated her.,2
1777dpc,k4s4n8g,Did you ever hear the tragedy of Darth Divorceis the Wise?,2
1777dpc,k4sm3iz,That's why when things go south you need to call Darth Vader's and Sons lawyer group,2
1777dpc,k4rk0ds,I'm still here. I didn't hear no bell.,2
1777dpc,k4s0z63,Is that why you keep reposting this?,2
1777dpc,k4ry8jb,A joke is supposed to be funny,2
1777dpc,k4slecd,My parents are still in the house I grew up in. My Dad doesn't want to leave his greenhouse and garage in a house 500 km away from the nearest offspring. He still drives his Tesla 500 km for any servicing he can't do on his own. Mom video calls me a few times a week. They are rock stars among their contemporaries.,2
1777dpc,k4rkzq4,Cause people stay together for the kids.........and may divorce after the kids have grown... not wait till they die.  Sheesh,2
1777dpc,k4sp4vm,I talked to my mom. My stepdad became an alcoholic and just started being mean toward my mom. She put up with it for years and finally got the courage to leave .,2
1777dpc,k4tea1y,"I dunno, I quite like this version. I feel it it underscores how bitter and mean they are and that really sells the 'waiting for the children to die' line.",2
1777dpc,k4s4ms0,"Wait, for real? *How*",2
1777dpc,k4sfgzd,"Happens all the time. I’m watching it happen right now with a favorite couple, and we’ve known their kids since preschool, and our kids went to school with them K through 12. So, not funny. 

Waiting for the kids to die?  Hilarious!!",2
1777dpc,k4s1y20,I was amused,2
1777dpc,k4s5st4,"God Buddy Hackett was funny!

Guy goes duck hunting for the first time.  He shoots a duck but it falls in the farmer’s yard.

Guy goes to get the duck and the farmer  says “It’s in my yard, that makes it my duck.”

Hunter says “But I shot it.  That makes it my duck.”

Framer says “Fine.  We’ll settle this country style.”

Hunter says “What’s country style.”

“Well we take turns kicking each other in the nuts.  Last man standing gets the duck.”

The hunter really wants the duck, it’s his first one ever so he agrees.

Farmer says “We’re on my land, so I get to go first.”

Farmer winds up and kicks the hunter as hard as he can, right in the nuts.  Guy rolls around on the ground in agony for a few minutes but finally gets back on his feet.

He’s ready to get even now.  Says “Alright, it’s my turn.”

Farmer says, “That’s okay.  You can have the duck.”",2
1777dpc,k4sfubj,She was a beautiful Polish lady: Petri Dish.,3
1777dpc,k4smf07,"Like it actually stops those ancient hags from doing it anyway… 

Because it’s all about the * self *",3
1777dpc,k4sugke,"I remember....

Unfortunately.",3
1777dpc,k4s4vwd,I heard he despises the beach,3
1777dpc,k4ryo65,It is funny,3
1777dpc,k4rxfrm,"But, the expected result is children outliving their parents. So, what is the implication of the parents' wait? That is where the joke is supposed to be. Like I said, this is just subverting expectations for the sake of a shock. Doesn't land as a joke. I am sure there is a joke to be told with the premise, but rhe kids dying ain't it.",3
1777dpc,k4s81cq,"If both spouses agree on one lawyer, and the couple have already worked out most of the details in advance. 

Believe it or not, there are a lot of couples who can part ways without fighting over everything little thing.",3
1777dpc,k4sij6x,Sand ...,4
1777dpc,k4s4l3u,"I think the final line comes off as just mean more than it intends.

It wants to subvert the expectation of more story/joke but it kinda implies they knew or wanted their kids to die before them.

Maybe the final line might have been something like, 

She says, ""we were staying together for the kids, but you know...Covid.""

There is still a punchline about dead kids, but the death is a shocking suprise and is less ""mean""?",4
1777dpc,k4sbtzo,"And doing that... gets the lawyer disbarred??

But. why. that sounds so reasonable.",4
1777dpc,k4sgy7p,"Still the same thing though, so why sugarcoat it when you can just say whatever you actually mean? 

Your response is making sense though, as to why so many tell half-truths instead of just speaking up. 

Tell the whole truth instead, even if someone think you’re mean for it.",5
1777dpc,k4si55w,It’s definitely mean. But mean things *can* be funny. They’re still mean. But they’re also funny.,5
1777dpc,k4stzb0,"The prior commentator was really just making a joke. 

The only way a lawyer would get disciplined in such a situation is if he or she  became an advocate against a party that he/she had previously represented in the same matter, or used (attorney-client) privileged information against his (now former) client.",5
1777dpc,k4shgo1,"We're talking about joke construction, not couples' communication. Whatever you're going through, I hope you're doing alright.",6
1777dpc,k4six9m,"Exactly like this. Why does people think im not okay for speaking my mind? What the hell is wrong with people? 

I dont get it.",7
1777dpc,k4t2klb,That's high- and low-context culture together with direct and indirect communication styles my friend. Not everybody in the world is culturally the same,8
1779sv3,k4rod0x,You could leave the smart son out of this joke and it would be just as effective and shorter.,0
1779sv3,k4s02f2,Heard that one on the playground in 1968. Still pretty funny.,0
1779sv3,k4s1309,I just am curious what the smart son got for $2.,0
1779sv3,k4rpkqz,Hey! A joke on here I have never seen before!,0
1779sv3,k4rte7b,"Less a joke, more like a rap",0
1779sv3,k4rs18x,Who says the second son was the dumb one?,0
1779sv3,k4s4aqh,From a truck,0
1779sv3,k4s4trx,"He got $25 when my brother told me this joke in 1992. Inflation is a bitch, man",0
1779sv3,k4s8x7u,"Your joke never states the final condition of the duck. It flew into the path of a semi but you did not say it got hit. It's usually overlooked but the duck wasn't that ""fucked up"" and it survived. In fact some time later it had fully recovered and walked up to a lemonade stand and he said to the man running the stand...",0
1779sv3,k4scdq9,He should have stayed home and fucked the duck.,0
1779sv3,k4sd5kc,And that dumb son’s name? Albert Einstein!,0
1779sv3,k4t1ohg,Where is this whorehouse again? Asking for a friend,0
1779sv3,k4t5e2r,Dumb luck beats brains anytime,0
1779sv3,k4tejeh,"I heard the punchline as “I got a fuck for a duck, a duck for a fuck, the duck got fucked, I got $15 and I’ve still got the fucking duck!”",0
1779sv3,k4s1wkq,"That was barely a punchline, I want my time back",0
1779sv3,k4s2zqf,"Too long, I have better duck to fry 🥺",0
1779sv3,k4s0n00,And I’ve still got the fucking duck,0
1779sv3,k4sxv1e,/r/Boomershumor,0
1779sv3,k4sfem2,"I'm giving you my upvote for posting but I'm really not a fan of this 1. Its way to long (that's what she said) and for a sub standard line that I didn't think was very good 

Again you had the balls to make a post and for that reason you get the up doot",0
1779sv3,k4s77ih,…this joke is related to good ole Johnny Fuckerfaster…,0
1779sv3,k4skac8,"Heard the same exact punch line, but with a completely different setup. Just as clunky to say out loud.",0
1779sv3,k4t18wx,r/shaggydogstories might appreciate this.,0
1779sv3,k4t77n9,"""any extra, take that to the whorehouse on your way home"". Whereas the smart kid spent the extra money there, I thought the dumb kid would come back with more money having earned at the whorehouse on the way home...",0
1779sv3,k4tayls,He fucks!,0
1779sv3,k4s8ol2,"But the stupid son accidentally succeeds, better than the smart son.",1
1779sv3,k4rtpo9,I’m not in a rush. I like both sons in the joke.,1
1779sv3,k4sdnbs,But then how would dumb people get a chance to feel superior to smart people?  Have to consider subtext and the audience(who largely don’t get subtext).,1
1779sv3,k4shcfs,Maybe he did it for the flair,1
1779sv3,k4sl2ct,It’s called foreplay.,1
1779sv3,k4sod8d,"The first time I heard this, it was 3 sons.",1
1779sv3,k4t2j1n,I read it in Mark Wahlberg voice,1
1779sv3,k4su6zl,That would possibly explain how he could get anything at a whorehouse for 2 dollars.  Though 1868 might be more accurate.,1
1779sv3,k4s81pu,"In the original version, the duck was hit by a chariot.",1
1779sv3,k4s2imh,"That number gives you an idea of how old this joke is.

How far into the past do you have to go to find a $2 whore?",1
1779sv3,k4rt77a,I recall this one from grade school circa 1985,1
1779sv3,k4rv4eq,That last line is more like a wrap.,1
1779sv3,k4t64xi,"That would be deflation, since the price has gone down in this scenario",1
1779sv3,k4sdlda,Nice. And now I have the song stuck in my head.,1
1779sv3,k4svxoi,"Here, try this one. What do you call a Japanese boxer that has a father with diarrhea?
That  would be a slap happy jappy with a crap happy pappy.",1
1779sv3,k4sgh81,"I'm guessing it's supposed to go ""$15 bucks when the duck got fucked up by a truck""",1
1779sv3,k4sr50p,"I guess, with all of those ""uck"" words, _luck_ was on his side.",2
1779sv3,k4si0hh,Elon ? Is that you ?,2
1779sv3,k4s52pb,I need the lead in.,2
1779sv3,k4se0o7,I post here when I can contribute……or for my own entertainment.,2
1779sv3,k4s3eem,"I found an article on it, I'd judge somewhere in the 1920's if the article is to be believed.


https://www.straightdope.com/21344215/corrected-for-inflation-have-prostitution-prices-been-essentially-the-same-for-thousands-of-years",2
1779sv3,k4s4hmc,">How far into the past do you have to go to find a $2 whore?

What year was your mom born again?",2
1779sv3,k4sz55k,Well.....I've heard of a 50 cent bj in my town...,2
1779sv3,k4rv38d,It was old then too,2
1779sv3,k4ry0uw,A duck wrap,2
1779sv3,k4ta1r6,15 bucks for a truck fucked duck,3
1779sv3,k4t7oj7,What a schmuck.,3
1779sv3,k4s5kjk,"OK, I get it, I’m the smart brother.",3
1779sv3,k4t11ui,It’s foreplay,3
1779sv3,k4s45qo,"So, if $2 then was about $200 today, that means that they sold that duck for about $500 in 2023 dollars.

I'm beginning to think that this might not be a true story...",3
1779sv3,k4td6w6,😂😅😅😐😕,3
1779sv3,k4setvf,My 63yo spouse has been randomly throwing out this punchline for over 45 years. Still fun to see this on r/jokes.,3
1779sv3,k4sbbei,Quack,3
1779sv3,k4tdv92,Do ducks go 'cluck?',4
177bp8z,k4si0sn,I’ve heard this before but you told it really well. Thanks for the laughs.,0
177bp8z,k4skll2,"A Soviet man's parrot escapes and he goes to the KGB to report it.

The KGB agent says 'this is not a matter for the KGB, please report to a police station'.

The man says, OK, but I must report that I do not agree with anything he says!",0
177bp8z,k4se70u,Pretty good joke,0
177bp8z,k4s1hvg,Two jokes in one - nice.,0
177bp8z,k4s5pmu,I only count one.,1
177bp8z,k4s8fy0,"> ""I would like to apologize profusely ..."" a total change in attitude, and   
>  
>""... what did the chicken do?"" is the second. 

This could have ended on the first joke. The second one is bonus.",2
177bp8z,k4sctlo,I don’t see the humor in what you perceive to be the first joke.,3
177bp8z,k4sklju,I would have been really disappointed if it ended on what you consider being the first punchline,3
177bp8z,k4sxq4x,"Its not a change in attitude, parrot is scared for its life cause the chicken died of unknown reasons. 

The only joke is asking what the chicken did.",3
177bp8z,k4sd55p,"You’re not alone. I think their idea is that it’s funny that the parrot is, in fact, sentient and capable of rational thought and, not just speech, but flowery speech?",4
177fbmy,k4sv2br,"This guy might be ""Praying for the End of Time"" just like in Meatloaf song.",0
177fbmy,k4spmj1,I feel like this is really funny but I don’t get it,0
177fbmy,k4t5mzp,"Another version, with ear rings.",0
177fbmy,k4t8zgl,Oh I like this one.,0
177fbmy,k4spzk9,"She found another woman's bra in his car and he is saying ""no its mine I wear it""",1
177fbmy,k4sq3p4,He was cheating on his wife and the other woman forgot her bra.  When the bra was found by the wife the guy claimed it was his ie he is a crossdresser not a cheater,1
177fbmy,k4sq7pj,"Oooh! 

Yeah it’s really funny",2
177fbmy,k4szxnf,"Not necessarily crossdresser, just wears a bra. 

In my mind, he was a typical office dude, 50ish years old, wears a shirt, fancy pants and fancy jacket, but wears a bra under the suit.",2
1773bp7,k4ro3k9,Ghosts sit around campfires and tell chuck Norris stories.,0
1773bp7,k4roz36,My favorite is “Superman wears Chuck Norris pajamas.”,0
1773bp7,k4rz9w0,Chuck Norris can believe it's not butter,0
1773bp7,k4qogx6,Chuck Norris doesn't go hunting. Hunting implies the possibility of failure. Chuck Norris goes killing,0
1773bp7,k4qvsjn,Chuck Norris once ate an entire bottle of sleeping pills. It made him blink.,0
1773bp7,k4qpjc8,Chuck Norris can slam a revolving door,0
1773bp7,k4r8x69,"There used to be a street named Chuck Norris, but they had to rename it because nobody crosses Chuck Norris and lives",0
1773bp7,k4rlxee,"Chuck Norris was once bitten by a King Cobra. After 3 days of suffering in agony, the Cobra died.",0
1773bp7,k4r6igt,Chuck Norris can do a wheelie on a unicycle.,0
1773bp7,k4rhf3m,"I can't stand these dumb jokes, if Chuck Norris was really such a badass, he'd show up and slam my head into the keybghhfjfdyytghvcdfuyrthccbbvgt",0
1773bp7,k4rrdwt,"Jesus walks on water, but Chuck Norris swims through concrete.",0
1773bp7,k4r21cl,Chuck Norris can clog a toilet by taking a piss.,0
1773bp7,k4r6t2x,Chuck Norris threw a grenade and killed 50 people. Then the grenade exploded.,0
1773bp7,k4s8hk8,Chuck Norris won the Tour de France on a stationary bike.,0
1773bp7,k4qqn86,Chuck Norris built the hospital that he was born in.,0
1773bp7,k4s37aj,"The Grim Reaper once had a ""near Chuck Norris"" experience",0
1773bp7,k4qt143,Chuck Norris visited the Virgin Islands while on vacation. They are now only known as the Islands.,0
1773bp7,k4rkl2h,Chuck Norris's cowboy boots are made from real cowboys.,0
1773bp7,k4qv6y7,"Chuck Norris counted to infinity, twice.",0
1773bp7,k4s2y6c,"Chuck Norris didn't dial the wrong number, you answered the wrong phone.",0
1773bp7,k4qljxk,Chuck Norris doesn't sleep... He waits,0
1773bp7,k4rf6vj,"Chuck Norris has a bear rug in his living room.  The bear isn’t dead, it’s afraid to move.",0
1773bp7,k4ryxdq,Monsters check under their bed for chuck Norris,0
1773bp7,k4qlz3j,"If you can see Chuck Norris, he can see you. If you can't see Chuck Norris, sudden death may be imminent.",0
1773bp7,k4rz34o,"Kids sometimes pee their names into the snow.
Chuck Norris pisses his name into concrete.",0
1773bp7,k4qt46v,Chuck Norris caused the Big Bang when he cracked his knuckles,0
1773bp7,k4r0r9o,Chuck Norris stared at the sun during the eclipse.  The sun blinked.,0
1773bp7,k4r1amt,Chuck Norris won a staring contest with a statue.,0
1773bp7,k4r60ka,Chuck Norris is the reason there’s no life on Mars,0
1773bp7,k4r9i9z,All of the fatalities in mortal kombat are based on  actual eyewitness accounts of what Chuck Norris does to his enemies.,0
1773bp7,k4rbvec,Jesus walked on water. Chuck norris swam through land.,0
1773bp7,k4rezlm,"Chuck Norris doesn't tea bag people, he potato sacks them.",0
1773bp7,k4s18ah,Chuck Norris got in a hot tub......and made it hotter.,0
1773bp7,k4srxvf,“Chuck Norris does not look for shade. He just tells the sun to go away.” - this was an original from my son when he was 4 years old.,0
1773bp7,k4r7396,Chumbawumba stopped getting up again at the mere thought of Chuck Norris.,0
1773bp7,k4rh30c,"Chuck Norris doesn't read books, he just stares them down until they give up their information.",0
1773bp7,k4rh3eh,"Instead of making the ""ding dong"" sound, Chuck Norris' doorbell asks you, with genuine concern, if you're sure you really want to do that",0
1773bp7,k4rjhgy,Chuck Norris can check his Socials with a type writer,0
