Post ID,Comment ID,Comment Text,Comment Level
177ahjc,k4ta3jf,3% net profit in your own link lmao. Profit margins on insurance are extremely small. You think insurance companies are pulling out of states like California and Florida because they’re making money? No. They are losing money insuring people there. Billions brought in and billions goes out to pay for all the losses and overhead. You just don’t understand how business works.,5
177ahjc,k4t4wiy,"I have too, I believe even more strongly it should be givernment run.",5
177ahjc,k4t53ue,How's being 18? Conscripted yet?,5
177ahjc,k4t3w5w,Lol that guy is such a fuckin idiot. Jesus Christ…. He clearly doesn’t understand the concept of profit margin.,6
177gsel,k4suuy9,Now I know!,0
177gsel,k4sv3c3,That's why they play the full ads now,0
177gsel,k4sucq2,True 100%,0
177gsel,k4t0i5l,GGGGIIIIJOOOOOOOOEEE.,0
177gsel,k4t0rob,Ublock Origin.,0
177gsel,k4t0s97,"This advice is how you get ads that just scream and repeat.

HEAD ON. APPLY DIRECTLY TO THE FOREHEAD.     
HEAD ON. APPLY DIRECTLY TO THE FOREHEAD.",0
177gsel,k4t2h1k,">Porkchop Sandwiches!    
^([Porkchop Sandwiches])   

Porkshop Sandwiches!",0
177gsel,k4t3mn8,I wouldn't know what they were selling even if there's no skip button (I have dementia),0
177gsel,k4szetd,And knowing is half the battle!,0
177gsel,k4svzv9,And knowing is half the battle.,1
177gsel,k4tfo0x,Then you have 15 seconds to turn off the volume and switch to another tab to use that time for something useful,1
177gsel,k4t3vqe,YOOOOOOOO JOOOOOOEEEEE,1
177gsel,k4t7o4l,And still no idea why i'd need to do that.,1
177gsel,k4t8dkc,holy memory loss,1
177gsel,k4tafx4,New response just dropped...at least I think it's new,2
177g4b3,k4sr82e,dora is the reason I speak Spanish,0
177g4b3,k4t4bmj,"Bro this is like saying “Avengers>>>Peppa pig”

This makes no sense what the fuck",0
177g4b3,k4ssm4q,"Hola, soy dora. Can you say “this post is complete bullshit” In Spanish?",0
177g4b3,k4sws9m,"uh oh, can you help me find op's house?🤔",0
177g4b3,k4t4748,Boutta @ the r/doratheexplorer community,0
177g4b3,k4t7e29,I'll break your legs in Spanish,0
177g4b3,k4t2zx4,Hola soy Dora! We are going to track down the IP address for this person! Do you see the IP address?,0
177g4b3,k4t656c,You put Dora back right fucking now 😤,0
177g4b3,k4sy4yt,"Weaboo detected

Opinion rejected",0
177g4b3,k4sy5jx,Fuck you Dora is awesome,0
177g4b3,k4t59d6,"Blue's Clues, Foster's Home for Imaginary Friends, Jackie Chan Adventures, Totally Spies, Teen Titans, etc. I can go on all day.",0
177g4b3,k4t7361,"hell nah there’s something wrong with you, dora was fucking amazing",0
177g4b3,k4t8kvq,Imagine only watching anime and call Dora the explorer mid. Thats a sad childhood.,0
177g4b3,k4t16y4,Fucking weeb,0
177g4b3,k4t9ww9,"This you?

![gif](giphy|KDjZuhl1qr8IgDmsJc|downsized)",0
177g4b3,k4t7zk2,fuk u dora was great,0
177g4b3,k4t8e64,L post,0
177g4b3,k4t3el1,Dora could beat every single character here in a fight.,0
177g4b3,k4t6t2m,r/fuckyouinparticular,0
177g4b3,k4t79ps,Hola soy Dora! Can you spell Co-cai-na?,0
177g4b3,k4t81yw,Dudu dudu du Dora,0
177g4b3,k4t93xh,Who the hell has beef with DORA?!,0
177g4b3,k4t97rj,"*To summarize everyone's apparent message:*

**""Go touch grass..""**",0
177g4b3,k4t99tx,"Not only does OP try to diss Dora  and my beloved Swiper - all the others you watch when you are older than idk, 8 and Dora is for like 4 year olds. A whole different class",0
177g4b3,k4ta3yx,Dora has better animation than all others on this list,0
177g4b3,k4tawjs,Why tf are you comparing one piece and dragon ball to a literal kids show,0
177g4b3,k4t3zys,The only one of these I watched as a child was dora,0
177g4b3,k4t7wq0,"Ya, I didn't watch anime as a child. I watched doc mcstuffins like a boss",0
177g4b3,k4t9tl0,Hey.....Dora is fucking yo!,0
177g4b3,k4tb8at,Dafuck you say about DORA??!!,0
177g4b3,k4tbf55,Only a fool would hate a show which has cool characters such as swiper,0
177g4b3,k4tc76e,"Strong disagree, Dora was top tier, it absolutely made my childhood. :)",0
177g4b3,k4svaum,I sadly only watched a bit of Pokémon when I was a child (my mom didn’t and still doesn’t like anime),0
177g4b3,k4t8upt,naruto one piece and dragon ball z? Are you ok?,0
177g4b3,k4t8z9b,It shows that you only grew up with Cartoon Network lmao,0
177g4b3,k4t91zv,Thank you for making my not you childhood awesome,0
177g4b3,k4t9x9c,Dora is amazing wdym,0
177g4b3,k4tacfr,why all anime?,0
177g4b3,k4tacqv,What? Dora the Explorer is my favourite Anime,0
177g4b3,k4tatfk,Who the fuck puts a single cartoon in a line full of animes,0
177g4b3,k4tavq6,is it bad i started watching one piece at 19?,0
177g4b3,k4taygd,"Bruh, i can agree anime are cool but wtf dora are cool too.",0
177g4b3,k4tbhdq,"Me who was too poor for cable and had none of these, tho I did grow up with Sesame Street.",0
177g4b3,k4td9hn,"As a weeb, I loved dora as a kid and ur opinion is trash",0
177g4b3,k4t7ydd,"Pikachu, Togepi and jigglypuff.",0
177g4b3,k4t9ck7,"I don’t think 4kids realised what they were doing back in the 90s. The generation they have spawned from all their excessive anime is full of weebs who are all still probably single because no one, no matter their gender, sexual orientation or race, gives a flying fuck about half these shows.",0
177g4b3,k4t9g1q,4Kids ain’t much of a childhood in all honesty. At least not for developing youth.,0
177g4b3,k4t9ujb,I'd wish i could watch Dragon ball in the Netherlands,0
177g4b3,k4ta3zs,🤣,0
177g4b3,k4taod6,Beyblade,0
177g4b3,k4tb07j,Pokemon and dora I get but the rest isn’t childhood,0
177g4b3,k4tb0kd,What about Mazzy?,0
177g4b3,k4tbox7,Hola! Soy Dora! Te romperé la columna y te empalaré con ella!,0
177g4b3,k4tbueq,"Oh damn, yes. Watched them all and partly still do ❤️ can still remember the anticipation when waiting for the show to start on television, as a child.",0
177g4b3,k4tbze1,Shut up! Dora is awesome!,0
177g4b3,k4tc0h1,"Cries in Mexican 😿

Fur reel don’t be meen to us Dora is cool 😾",0
177g4b3,k4tc19a,this post is some mierda loca,0
177g4b3,k4tc3t8,Fr,0
177g4b3,k4tc3ym,Weeb,0
177g4b3,k4tc413,"dora taught me english, so it's cool",0
177g4b3,k4tc5cd,"I always wondered why but where I lived other than pokemon, bakugan and some other none of these ever played maybe yugioh as wrll but nothing other than that",0
177g4b3,k4tcrir,"I watched none of these as a kid, I watched stuff on Cartoon Network.",0
177g4b3,k4td3er,"Show some respect for Dora, and this is coming from a huge weeb",0
177g4b3,k4td5mi,Wtf you were a weeb since childhood?,0
177g4b3,k4tdg55,Dora is the reason I speak English. Thanks to my sisters who always wanted to watch it. That's what you get when you're the middle child,0
177g4b3,k4tdijt,Dora is the best anime,0
177g4b3,k4tdna5,Don't do my girl dora like that... She was my only friend who would ask me shit.,0
177g4b3,k4tdqz1,You only watched anime?,0
177g4b3,k4te4ez,"Inuyasha: a slice of life anime that tries to be a shonen, but ends up reverting back into a slice of life.",0
177g4b3,k4te840,my mans a weeb,0
177g4b3,k4tep3i,"Bro compared pizza to fries

Both good but you can't just pick one to be better",0
177g4b3,k4tep52,Yea we had heat🔥 coming up,0
177g4b3,k4teq90,"Dora was actually entertaining during childhood
But as you get older you see how ""special' Dora really is. 

*Dora, the temple is just their at your back for fuck sake!*",0
177g4b3,k4tev74,Its exactly the opposite,0
177g4b3,k4tf6zg,Actually Dora ia good!,0
177g4b3,k4tfczd,Weeb,0
177g4b3,k4tffjt,"I never liked inuyasha, he freaked the hell out of me, and one piece opening on 4kids was my themesong",0
177g4b3,k4tffrv,"Bro don’t disrespect Dora like that, me and my cousin would always go exploring in the park outside our old family house every time we watched an episode of Dora.",0
177g4b3,k4tfjaw,Campy kids show made by Americans< campy kid show made by Japanese,0
177g4b3,k4tfjrm,"The only anime I watched when I was actually like 4-9 years old were Pokemon, Bakugan, Inazuma eleven and Beyblade but I treated them as normal cartoon because I didn't know there was a completely separate term to name them. Things like Dragon ball or one piece weren't aired in my coutry. In 2018 it was when they finally showed Dragon ball super, One piece, Monster hunter stories, Assasination classroom, Bleach as well as My hero academia and I instantly fell in serious love with anime.

Even tho today I massively prefer anime over western cartoons you can't even imagine how much I miss things like Flapjack, Dexter, Samurai Jack, Chowder, Originall Powerpuff girls, original adventure time, Regular show etc.",0
177g4b3,k4tflv7,Dora was a solid W. L post,0
177g4b3,k4tfqad,xd,0
177g4b3,k4t526o,Hey! Map can tell me op’s billing address? Do you see the pipe bomb?,0
177g4b3,k4t552t,Man I fuckin cried when Brock parted with Ash,0
177g4b3,k4t2461,I’m so happy I see Inuyasha on this list I never see it on these types of posts😭,0
177g4b3,k4srcjo,Where’s Agumon?,0
177g4b3,k4t658x,I am getting nostalgia from this meme i was like 3 when i first saw this meme,0
177g4b3,k4t7qrl,"Everything but Naruto, stretchy pirate guy, and Dora. 

Naruto was definitely popular, I just didn't like it. And the stretchy pirate guy show wasn't popular until I was out of high school. I don't even know the name. As for Dora, I was too old.",0
177g4b3,k4taff9,"Where shaman King, where death note, where Berserk, where X-Men, where Spiderman, where sailor moon",0
177g4b3,k4teh4s,i dunno Naruto is pretty overrated imho... and i can't stand One Piece art style but that's me,0
177g4b3,k4t1olv,Inuyasha never made anything awesome.,0
177g4b3,k4tc0sp,"Dora is stupid

change my mind",0
177g4b3,k4tdx51,Dora is so boring. Not to mention it is the most recent among them so no comparison.,0
177g4b3,k4sxdwk,InuYasha but no Beyblade or Bakugan? Who the fuck watches InuYasha?,0
177g4b3,k4t7puw,Fuck you Dora. Stupid idiot,0
177g4b3,k4syccr,I’ve watched every single one of these except Dora in my childhood and they were awssooome,0
177g4b3,k4tfy45,Yes because the 1000 episode anime with highly detailed character arcs is clearly in the same league as the children’s show that teaches spanish to 3 year olds.,0
177g4b3,k4t6lbn,dora in my country teach about english. and it might be the reason why I love english subject at grade school,1
177g4b3,k4t6ew0,Dora es la razon por la que hablo ingles,1
177g4b3,k4t6r7c,"I admit, I did not expect that",1
177g4b3,k4tb0yp,Yeah same. My mom was fine with me watching and learning from it. She mentioned it to my preschool teachers incase they would teach me more but the teachers thought my mom was being over the top and didn't go that far with me.,1
177g4b3,k4tegid,I learnt french from her. Basicly how to hate other people,1
177g4b3,k4temkd,she taught me english:),1
177g4b3,k4tagfi,Damn right it makes no sense... We all know Peppa Pig would OBLITERATE the Avengers!,1
177g4b3,k4tbdyl,Yea ikr. Peppa pig SOLOS,1
177g4b3,k4ste2z,esta publicación es una mierda,1
177g4b3,k4tadcx,"We’ve got to go over the river, past the field of flowers, and then to *op’s exact coordinate location*",1
177g4b3,k4tcsj4,"🎵backpack backpack,backpack backpack🎶
 I'm loaded up with a thing and a Knicks knacks too🎵 anything that you might need i got inside for you🎶 backpack backpack,backpack backpack yeah!!🎵

This person needs a molotov cocktails to burn op's house. Can you find blue and red clothes molotov cocktail?.",1
177g4b3,k4tb6hw,Wtf is going on with the top post of month,1
177g4b3,k4t3d0v,"Can you say 

""92.28.211.234
N: 4.818851
Y: -75.7141593,21
Número SS: 6979191519182016 
IPv6: fe80::5dcd::ef69::fb22::d9888
DMZ: 10.112.42.15 MAC: 5A:75:3E:7E:00
ISP: Ucom Unversal DNS: 8.8.8.8
ALT DNS: 1.1.1.8.1
DNS: SUFFIX: Dlink
WAN: 100.23.10.15
TIPO WAN: Soldado Nat GATEWAY: 192.168.0.1
MASCARILLA SUBNET: 255.255.0.255 UDP PUERTOS ABIERTOS: 8080 80
TCP PUERTOS ABIERTOS: 443
RUTA DEL VENDEDOR: ERICCSON
VENDEDOR DE DISPOSITIVOS: WIN31-X
TIPO DE CONEXIÓN: Ethernet
ICMP HOPS:{
192.168.01
192.168.1.1 100.73.43.4
host-132.12.32.167.ucom.com
host-66.120.12.111.ucom.com
36.134.67.189 216.239.78.111
sof02s32-in-f14.1e100.net
TOTAL HOPS: 8

DISPOSITIVOS ACTIVOS:{

[HTTP] 192.168.3.1:80 => 92.28.211.234:80 [HTTP] 192.168.3.1:443 =>
92.28.211.234:443
[UDP] 192.168.0.1:788 => 192.168.1.1:6657 [TCP] 192.168.1.1:67891 =>
92.28.211.234:345

[TCP] 192.168.54.43.7777""

In Spanish?

/s just in case",1
177g4b3,k4t9jdj,"Most 45 YO Redditors who just binge watched One Piece:

“Childhood?”",1
177g4b3,k4t7zai,"Billy and Mandy, Powerpuff Girls, Dexter's Lab, Cow and Chicken, Ed, Edd, and Eddy, honestly Cartoon network had more hits than misses during the Cartoon Cartoon/What-a-Cartoon era.",1
177g4b3,k4td69y,"Looking back at Totally Spies, that and Kim Possible is probably why I have a thing for red heads.

Those shows planted things that didn’t bloom till years later.",1
177g4b3,k4tbgbt,Exactly,1
177g4b3,k4t42j0,W answer,1
177g4b3,k4tce5w,"&#x200B;

![gif](giphy|HVQrCz5mQJAcVTYiBu)",1
177g4b3,k4tama3,Dora has a better story than one piece,1
177g4b3,k4t4bs3,"If shes Catholic, tell her Pokemon was blessed by the Pope",1
177g4b3,k4t6nri,"show her prof oak

there's no way she will refuse to watch it anymore",1
177g4b3,k4tc018,No same with me I started watching anime when I was 18,1
177g4b3,k4tegxx,I was 15 when I started,1
177g4b3,k4t6q9l,That happened like at the end of every season,1
177g4b3,k4t8ac6,"i never see bleach on any of them.

i am still sad.",1
177g4b3,k4sw925,Where's Angron? Lol,1
177g4b3,k4tbo61,Who tf is watching berserk in their childhood bruh,1
177g4b3,k4tezl7,">i dunno Naruto is pretty overrated imho

The first show is goated tho",1
177g4b3,k4tc59k,"for context I watched other cartoons like Samurai jack, kick buttowski, kid vs Kat, jhonny bravo and jhonny test, Shin Chan etc...",1
177g4b3,k4t8m3g,in Italy it's Peppa pig lmao,2
177g4b3,k4t8n1g,Sorry i don't speak french,2
177g4b3,k4tb04u,"Her 7’1” height gives her a huge physical advantage over most of the Avengers except maybe Hulk, but I think she can defeat Hulk in a fistfight if she tries hard enough

However none of them even come close to Peppa’s dad lmao",2
177g4b3,k4tfcxu,Is Peppa Worthy to lift mjolnir?,2
177g4b3,k4t5c2k,Perfecto😃!,2
177g4b3,k4tfvty,In Spanish we say quemar. Can you say quemar as we watch OP's house crumble to ash,2
177g4b3,k4tc6a5,These don’t appear to be your average fans.,2
177g4b3,k4tca5t,![gif](giphy|MgDMFsBo8XjDoCX26M),2
177g4b3,k4ta7y0,Anime good cartoon bad,2
177g4b3,k4t9o9d,Kids these days don’t know what they missed out on.,2
177g4b3,k4teiy8,"I remember watching shows like space ghost, flinstones, the jetsons, scooby doo, looney tunes, captain planet, swat cats, dexterous laboratory, johnny bravo, Ed Eddie eddy, cow and chicken, two stupid dogs, samurai Jack and more. Man, I wish I could go back to that era.",2
177g4b3,k4taple,Dora has better character arcs than DragonBallZ,2
177g4b3,k4tcxrv,Did you watch uncut dbz or without blood?,2
177g4b3,k4tc0l5,"wasn't it both?

i'm italian too and i have some memories of dora speaking english",3
177g4b3,k4tc6f8,From what I remember there was an episode where they went to Italy and I wonder what was in this episode in Italian,3
177g4b3,k4t8ps9,:l,3
177g4b3,k4t6o93,Taco,3
177g4b3,k4tfbx7,"Funny because anime are cartoons. Don’t let them hear that, they might have an aneurism…",3
177g4b3,k4taf8r,"Yeah, I became a bit of a prude, though, when I was like 16. I only watched adult cartoons and cop dramas. Lol.  Not sure what happened there, but I never gave anything on CN a chance until I was 21, and my friend let me borrow the first season of Adventure Time. I have to say, that era had some gems, too. Unfortunately, I missed out on making that a childhood memory. I don't actively watch cartoons these days, but anytime I hang out with a friend who has kids, I use it as an excuse to enjoy some cartoons. Lol.",3
177g4b3,k4tau7y,Lol,3
177g4b3,k4td9l9,With blood,3
177g4b3,k4tcdfx,"idk i never watched Dora, but i Remember being at my grandparents' house watching Peppa pig and like at 10 am there was Peppa pig in english on Rai Yoyo",4
177g4b3,k4t8uc5,"man Sorry i don't understand french :/
at my school i studied espanol not french",4
177g4b3,k4t78gn,quiero taco bell,4
177g4b3,k4t79e4,Guapo,4
177g4b3,k4t7y0p,Cabeza is just around the corner,4
177g4b3,k4tfw32,Its called animation. Cartoon is western style animation while anime is japanese animation.,4
177g4b3,k4tbapk,"Look up Samurai Jack.

It was from the same CN stable that produced Powerpuff Girls, Dexter’s Lab etc but isn’t really a kids show. It’s a slow, moody, atmospheric Samurai cartoon, with slicing up killer robots.

By the same guy (Gendy Tartakovski) is the original animated Clone Wars from like 2003. Very similar style and also worth a watch.",4
177g4b3,k4tf0g4,Naruto with blood?,4
177g4b3,k4tcaun,"Mate, That's Spanish",5
177g4b3,k4tdg0z,"Funny thing about Samurai Jack, it was originally supposed to have actual people instead of bots as the enemies, but ratings boards said hell no.

It’s why some of the early episodes have the oil really invoking blood tropes. It wasn’t just to pay homage to them, it’s cause it was blood.",5
177g4b3,k4tcggc,it was irony :/,6
1773m36,k4r5w9j,Since when??,0
1773m36,k4ql1ds,They're complete opposite demographics,0
1773m36,k4rhyly,I love tomboys,0
1773m36,k4qgcry,But... but I like tomboys...,0
1773m36,k4rt5c6,Tomboys typically aren’t looking for attention. There is no actual fight here to be had.,0
1773m36,k4qrlis,Well well well…..,0
1773m36,k4r088n,What is with this obsession with femboys? Is this a joke or are y’all really homosexuals?,0
1773m36,k4rgy13,"Tomboys and femboys are typically opposites, what are you on about? Also both have been gaining popularity recently, so this meme is entirely inaccurate.",0
1773m36,k4rixf0,"Take me down to the paradise city, where the chicks have dicks and the dudes have titties.",0
1773m36,k4s0tqz,"Bisexuals: ""Reality can be whatever I want.""",0
1773m36,k4roufr,Yeahhhh fuck all that. Tomboys for the win,0
1773m36,k4rm6bk,"My discord tag is ILoveTomboys, can't forget them",0
1773m36,k4rp8du,I love tomboys,0
1773m36,k4qwmmo,![gif](giphy|3o7aCRloybJlXpNjSU|downsized),0
1773m36,k4qcr59,So i looked up femboys and i have to say that they look way better than what the bathroom companies try to sell us.,0
1773m36,k4rrkkt,Except femboy pussy smells like shit.,0
1773m36,k4rpd8p,Tomboys are 100000% better,0
1773m36,k4rpixd,I honestly don't get why people like to compare tomboys and femboys so much,0
1773m36,k4rqoxk,"As a guy who’s into Tomboys, I gotta say I’m not with you on this one OP.",0
1773m36,k4rjzyp,![gif](giphy|3o7aCRloybJlXpNjSU|downsized),0
1773m36,k4rtcbj,"Tomboys:

Have tits ✅

Have a vagina ✅

Have a penis ❌

Femboys:

Have tits ❌

Have a vagina ❌

Have a penis ✅

From my point of view, it's pretty simple. Femboys are still boys, and if you are a guy and you like them, and you claim to be straight, you are not. If you are straight, you won't like femboys. If you like both, you're bi. 

If you like dick, you gay. If you like pussy, you not gay. 

Of course vice versa if you're a girl",0
1773m36,k4s64kg,Tomboy supremacy. I will not budge a millimeter on this.,0
1773m36,k4rh224,I prefer tomboys I think femboys are overrated,0
1773m36,k4sfpi3,Nah bro. I ain't gay. Tomboys still got that pussy.,0
1773m36,k4s6rtb,They're not the same demographic if you wanna call it that. And you just trying to speak for everyone and cant,0
1773m36,k4rpr8r,“We? There is no ‘we’.”,0
1773m36,k4s6zjv,Both? Both is good,0
1773m36,k4s9l5j,Our?,0
1773m36,k4r5ftr,These days every time I see a pretty girl I wish she had a dick,0
1773m36,k4rw3mi,Mr stark I feel great 👀,0
1773m36,k4s1dat,Those are two way different things lol,0
1773m36,k4saak0,Cry about it.,0
1773m36,k4sbqut,Tomboys be best,0
1773m36,k4sc0gi,Neither of them care about your attention,0
1773m36,k4scjl2,Both is good,0
1773m36,k4sry3m,Speak for yourself bro,0
1773m36,k4sv6o9,Incorrect,0
1773m36,k4syisj,Tomboys haven't lost my attention,0
1773m36,k4t02ow,Bullshit. My bi ass loves both,0
1773m36,k4t03er,"I got you, tomboys.",0
1773m36,k4t0dvp,Tomboys for life,0
1773m36,k4t3e61,"Lol, yeah no. Tomboys for life.",0
1773m36,k4t74w3,Tomboys > femboys.  Facts don't care about your feelings.,0
1773m36,k4tacuv,Personally as a straight dude who only likes women! Tomboys for the win anyday anytime!,0
1773m36,k4ro24f,"As a bi guy, I win no matter what. A hole is a goal",0
1773m36,k4rourq,![gif](giphy|3o85xIO33l7RlmLR4I),0
1773m36,k4ruwy4,"Both, both are good.  
being bisexual is too OP for you guys",0
1773m36,k4ruch9,Tomboys are just better than femboys,0
1773m36,k4reoax,Honestly? It would be the most confusing pair ever,0
1773m36,k4r89ft,femboys be adorable tho,0
1773m36,k4rw90f,"Uh, idk, I've never met a femboy who didn't want a huge goth tomboy gf to bully him",0
1773m36,k4sups0,"You say ""our"" like all of us are into men crossdressing as women.",0
1773m36,k4rtpm5,"I enjoy both femboys and tomboys.

Depends on my mood",0
1773m36,k4rf2bz,![gif](giphy|hM9zK1qvsrwek),0
1773m36,k4rnc7l,"fucking quit these femboy memes, theyre not funny at all",0
1773m36,k4seqok,They lost YOUR attention,0
1773m36,k4rnyyl,But... I like femboys and tomboys at the same time,0
1773m36,k4r6p80,Both are good,0
1773m36,k4rju8h,"Both, both are good",0
1773m36,k4rofs8,I like Femboys that look like tomboys. What now?,0
1773m36,k4rt9ul,![gif](giphy|sk2botJLaRp0UaCM99|downsized),0
1773m36,k4sb4de,I’m a trans girl tomboy,0
1773m36,k4rz6bp,I wish I was in the 2000s That seems to be a time where tomboys were a big thing. Now it's all about bloody femboys. Good for them but darn I'm super not into them,0
1773m36,k4s4vyr,i rater fuck carmen elektra with a dick than hulk with a vagina,0
1773m36,k4sb9um,"Tomboys 100% still valid, I just haven't seen any out in the wild in some time.",0
1773m36,k4sefuz,Femboys > Tomboys,0
1773m36,k4rk98a,Femboys hit different let's be real here 🥵,0
1773m36,k4rmtlo,Femboy supremacy,0
1773m36,k4riumd,Femboys are better. I can’t believe tomboy is in the dictionary but femboys isn’t,0
1773m36,k4rig0s,All femboys are the same,0
1773m36,k4srz3u,Tomboy are meh I'm 100% on femboy,0
1773m36,k4scbr9,Tomboy x Femboy is the best pairing,0
1773m36,k4sldnq,We are inevitable,0
1773m36,k4sltvf,Both.  Both is good.,0
1773m36,k4rtn1c,"As a trans tomboy who sees cis femboys passing better than me, this is absolutely true.

/hj",0
1773m36,k4qiaeo,Does DELTARUNE count? I mean Susie's always there so,0
1773m36,k4rtsjt,Can someone edit this so Thanos is in a dress? Please and thank you.,0
1773m36,k4rx18s,Why either? What’s wrong with women having pussies?,0
1773m36,k4s6jed,This is a certified masterpiece. 👏,0
1773m36,k4sr2b6,Hey it’s kinda true especially when you’ve been on hrt for some time,0
1773m36,k4t1en6,Their fault they didn't do good enough to stay relevant 🤷🏽‍♂️,0
1773m36,k4t2q3k,Well femboys are hotter so…,0
1773m36,k4r6btt,"both are really cringe and weird 

but the second is just pure degeneracy",0
1773m36,k4ryy9p,"Tomboys: for straight men who want to be gay

Femboys: For gay men who want to be straight",0
1773m36,k4sfq31,"As a fellow femboy, I do agree with this statement and since my mom is a tomboy too.",0
1773m36,k4sktvx,Femboys for the win 1000000%,0
1773m36,k4r86v0,Tomboys are just girls with no boobs and they dress like boys to distract attention from having no boobs to being dressed like a boy,0
1773m36,k4rzl9p,wtf people actually into femboys?,0
1773m36,k4ro9hc,Crazy :33,0
1773m36,k4rp10i,No they didn’t,0
1773m36,k4rruzb,"I know what tomboys are, wdym",0
1773m36,k4rvsx6,They never lost mine,0
1773m36,k4ryqa0,What,0
1773m36,k4s1s4p,"I have never lost interest in tomboy chicks, tomboys with short hair make me drop to me knees immediately.",0
1773m36,k4s9l4j,![gif](giphy|hM9zK1qvsrwek),0
1773m36,k4sabm6,"Definitely didn't lose my attention, I dunno what y'all are in about.",0
1773m36,k4scv34,Tomboys are how you introduced the naturally sexist 6 year olds that girls are cool too.,0
1773m36,k4sg0p1,Tomboys are goated tho,0
1773m36,k4sgohe,I like both,0
1773m36,k4silhh,Both. Both is good,0
1773m36,k4sq5yj,WHO SAYS I STILL DONT WANNA BE DOMINATED HUH?,0
1773m36,k4sulfy,Hit me upp 😝🩷,0
1773m36,k4svrwe,Gross but ok lol,0
1773m36,k4sxmjn,"Speak for yourself

My pansexual ass is happy with both of them.",0
1773m36,k4t0jvx,"One is strong, powerful, and overall chadly. The other is small and weak",0
1773m36,k4t0pcf,I love them both...,0
1773m36,k4t43t7,"I, for one, don't like femboys. I'd say I'm a tomboy but then I'd sound weird.  


Well shit",0
1773m36,k4t58on,"Poeple realized they can just be haul, I  guess",0
1773m36,k4t5no7,I mean Everything!,0
1773m36,k4t647c,Both of them are equally disturbing/disgusting to me. Femboys give me nightmares 🤮,0
1773m36,k4t6hvv,"Then why are men calling Femboys traps? Doesn't sound so positive, doesn't it.",0
1773m36,k4t7gg4,"You were given an opportunity to increase your bisexual vibes exponentially, and you didnt.
What a shame",0
1773m36,k4t91e9,Femboys have cocks lol stop this tomfoolery,0
1773m36,k4tbbmg,Tomboys x Femboys is the correct answer,0
1773m36,k4tbupy,"Good, have your femboys.  Yuk.  More tomboys for ME!  Nah, JK, I'm married, but, go get em, boys!",0
1773m36,k4tckgg,I'd like to see battle between the two,0
