Post ID,Comment ID,Comment Text,Comment Level
1776y29,k4snkew,"[Manga Spoiler] >!The character was only in the story for a brief time, but the handling Tozuka used was enough to set ablaze a fire that stood the test of time: Love.!< It really touched me back then as I remember. That was the point in the story that hooked me. Well, that and [Manga Spoiler] >!the fact that the night sky was without any stars besides the moon.!<

Repost because of coding error on my end. >.<",3
1776y29,k4r9gn2,[removed],3
1776y29,k4s5snf,"Well at this point in his arc [Manga Spoilers] >!Shen is still a lot like and obsessed with Feng to a degree, so he doesn’t actually care much about the other members of Union.!<

Reposted because I’m ass at tagging spoilers sorry",3
1776y29,k4swqot,"Same with Andy being such a sex pest. Though you could also say \[manga spoilers\]>!it's simple character development. Through Fuuko's influence, both Andy and the Union end up regaining the humanity they may have lost from having to deal with immortality and God's BS respectively.!<",3
1776y29,k4r6xx0,[removed],3
1776y29,k4rh2i5,"Sorry, your comment has been removed.

-  This belongs in the Source Corner at the top of this thread. In discussion threads for currently airing anime, discussions about source material, spin-offs, and unadapted content must be posted there, and not outside it. This applies specifically to comparisons to the anime or hints about future events, even if such hints are vague. Please note that you still have to tag your spoilers in the source corner.





---

^(Questions? Reply to this message, )[**^(send a modmail)**](http://www.reddit.com/message/compose?to=%2Fr%2Fanime)^(, or leave a comment in the )[**^(meta thread)**](https://reddit.com/r/anime/search?q=subreddit%3Aanime+author%3AAnimeMod+title%3A%22Meta+Thread%22&restrict_sr=on&sort=new&t=year)^(. Don't know the rules? Read them )[**^(here)**](/r/anime/wiki/rules)^.",3
1776y29,k4siw98,"[Manga] >!There's definitely enough for Summer. Autumn arc would mean adapting 6 volumes, Summer would mean 8 volumes. The average battle manga adaptation can easily cover 7-8 volumes in two cours with good pacing, less than that it gets too slow and more than that it gets too fast!<.",3
1776y29,k4smydu,is the manga still ongoing or ended?,3
1776y29,k4smy92,"Wow, I'm not paying any attention at all.

I need to start treating this anime with respect.

Everything smart flies over my head!",3
1776y29,k4sym6r,"There's also the fact that they broke contact between the chin touch and the chest touch, resulting in two bad luck events instead of just a single ""unluckier"" one.",3
1776y29,k4sbfp2,Not really? We saw the sign talking about the impending implosion earlier.,3
1776y29,k4sngok,"And the show shoves some sudden stripping on the MC, but the show disregards it in favor of having a more complex protagonist and a bigger focus on the premise!

I hate to say this, but I misjudged the tone based on the art style, I was honestly expecting something tremendously more mediocre.

Why am I smiling, laughing, and thinking so much?!

Ugh, it's not like I LIKE this anime or anything, don't get the wrong idea!!!

*blushing face*",3
1776y29,k4syq6a,he meant legal drinking age. that's why he says bottoms up,3
1776y29,k4rp91w,"Immortal then, like Faputa & Fushi",3
1776y29,k4royfz,"Yeah, he can be killed. It just won't take.",3
1776y29,k4tc5gk,dude is just letting the extra long cloth all hang out.,3
1776y29,k4rsvlw,"[*Sarabada*](https://files.catbox.moe/yvdc5f.webm)

Never underestimate the power of fingerguns in anime.

[](#smugpoint)",3
1776y29,k4rshmn,"Void killed Andy a ton of times during their fight, but Andy only needs to kill him once. And a projectile straight to the head would do it.",3
1776y29,k4rtm43,"He rejects her *because* she was so against it at the beginning of his episode. Back then he wasn't forcing himself upon her, he was trying to convince her and she didn't want to. Then at the end it's clear she's forcing herself because it might save their lives, which is why he doesn't want her to go through with it since she still hasn't agreed while not under duress.",3
1776y29,k4ra8sb,It's like why does he even bother putting pants on lol?,3
1776y29,k4r3a53,"Oh right, good point. I somehow already forgot he was literally going to meet them face-to-face.

""I've covered wars ya know""",3
1776y29,k4sfqeg,"That's still 10 years without intimate contact though, which is still awful.",3
1776y29,k4rehrr,Fashion design,3
1776y29,k4rpwpa,Why should a robot suit get to ignore the dress code?,3
1776y29,k4sb8hm,"Common motif/look for Union members are red tie and union emblem. Both have narrative purposes too, so I guess Void's design was meant to match the motif.",3
1776y29,k4td0dp,"When you design something, you got to have the drip to go with it",3
1776y29,k4t1jnn,"Lol that's true. If anime-onlies were to see a comment like that, \[manga spoiler\] >!and then not see a single reason to get hyped for Void all throughout the anime, they'd probably think it was some kinda meme because he got killed off so quick, or that we'd see flashbacks that make his character so much more likable.!<",4
1776y29,k4rit0p,"Sorry, your comment has been removed.

-  This belongs in the Source Corner at the top of this thread. In discussion threads for currently airing anime, discussions about source material, spin-offs, and unadapted content must be posted there, and not outside it. This applies specifically to comparisons to the anime or hints about future events, even if such hints are vague. Please note that you still have to tag your spoilers in the source corner.





---

^(Questions? Reply to this message, )[**^(send a modmail)**](http://www.reddit.com/message/compose?to=%2Fr%2Fanime)^(, or leave a comment in the )[**^(meta thread)**](https://reddit.com/r/anime/search?q=subreddit%3Aanime+author%3AAnimeMod+title%3A%22Meta+Thread%22&restrict_sr=on&sort=new&t=year)^(. Don't know the rules? Read them )[**^(here)**](/r/anime/wiki/rules)^.",4
1776y29,k4snuu3,"[178 chapters as of last week. Still ongoing.](https://mangaplus.shueisha.co.jp/titles/100081) (official source to read it on Manga Plus)

And this anime will have 2 cours, so about 24 episodes.",4
1776y29,k4soh3j,It's still ongoing.,4
1776y29,k4sf2c3,"The bad luck might have been him entering *that exact* building at *that exact* time though.

Fuuko's Unluck doesn't create things such as meteors or gasoline tankers, it just alters probability so that bad things happen involving them. If there hadn't been a building scheduled for demolition her Unluck would have likely resulted in something else bad happening to Andy.",4
1776y29,k4sff66,"Dynamite isn't going to spawn in because of her unluck, her unluck would bring them to where it is exactly when it's going to detonate",4
1776y29,k4srcyv,I don't think unluck is restrained by linear time.,4
1776y29,k4t3kjz,"Honestly, this is before the series actually gets good, so if you're really liking it now then you're in for in for a great ride",4
1776y29,k4t4zcc,"Sure, but just to mention, Fuuko is also legal to have sexual intercourse.",4
1776y29,k4rzkgu,"Worth noting that Andy’s ability is pronounced “Fushi” in Japanese (the character of Fushi being named after his immortality), so that’s a good comparison.",4
1776y29,k4snx2f,"Another good point!

He can be killed, he just can't REMAIN dead.",4
1776y29,k4s7imo,"Fuck, now i think bout it, that death really gruesome. finger fragment hits skull, shatters it, fragments turn Voids head into pink mush.",4
1776y29,k4rv2tt,Insert IRA Thatcher quote,4
1776y29,k4sy8q8,also a unexpected one,4
1776y29,k4rureb,"But it won't save their lives. She is doing it to both A) have sex once in her life and B) possibly kill Andy so he doesn't have to be tortured.

I just don't find Andy's reasoning as logical at all. I guess it is chivalrous, and will make some people forget about his earlier sexual harassment, but it makes no logical sense if his primary goal is to die.",4
1776y29,k4rdvkw,its summer he doesnt want the sun on his dick,4
1776y29,k4rba9w,Because he is a decent human being.,4
1776y29,k4t0dxf,So the animators don't have to continuously draw that complicated ass censor lmao.,4
1776y29,k4tc8se,being naked 100% of the time in a society that expect clothing is very inconvenient,4
1776y29,k4t0xdc,"It also makes more sense how Fuuko becomes so easily smitten with him too in spite of him acting utterly insane. Cause after years of no real contact without harming people, here comes a guy who's not only  willing, but is able to touch her without permanent harm.",4
1776y29,k4relb8,"""business robot"" is peak fashion, for sure",4
1776y29,k4rs1v6,"Rules are rules after all. Negators only get to negate one, and that is *not* the dress code!",4
1776y29,k4s02zi,"Reason A hasn't changed since the beginning of the episode though. She also had the desire to have sex at least once in her life there, but didn't want to do it because she isn't comfortable with it yet. Or at least not with Andy.

The larger reason is likely B, but even so she's only doing so because she feels like she owes him for saving her life by giving his spot to her and because she doesn't want him to go through 10 years of tests again. But she's still forcing herself to, as she didn't want to at the start of this episode. Andy doesn't want her to have sex out of a feeling of debt, as that wouldn't be of her own volition, which is why he reacted so negatively.",5
1776y29,k4sp7z5,"She is definitely motivated by her circumstances.

Her power is making her miserable, so she's taking agency and choosing to sacrifice something she wouldn't be willing to part with if she had a normal life.

TL;DR. She's been desperate since her parents died.  You can see this from the simple fact that she was intending to commit suicide in episode 1.

Also, sex won't kill him, sex isn't love after all.  Only way to die is to have the character fall in love, only way to achieve that is to protect and treat with kindness.",5
1776y29,k4sc7h4,What if someone's ability is Undress though?,5
1776y29,k4si757,"It seemed pretty clear to me that she was lying about her motivations. She actually wanted to do it, but can't just come out and say that because...society? Being an awkward 18 year old? Take  your pick.

Just because she didn't want to at the start of the episode doesn't mean she couldn't have changed her mind by the end of the episode.

Andy didn't give a shit about that ""own volition"" stuff earlier. He continually chases her while she is screaming no at the end of the first episode. The only reason he relents is when she says it won't work unless she likes him. I think it is just poor and inconsistent writing. Doing some Pepé Le Pew shit for some cheap laughs when it doesn't actually reflect how you want the character to be portrayed.",6
1776y29,k4suj9e,"Nothing wrong with being motivated by circumstances.

Are you talking about her virginity? I find thinking of it as a ""sacrifice"" fairly disgusting.

She's desperate for contact. He's desperate for death.

We don't know if any of that is true. She doesn't know how her own powers work since it is fairly hard to test them out. If a haircut was enough to call down a building destroying meteor it stands to reason that an orgasm could be enough to up that exponentially. I mean it likely means she calls down a dinosaur extinction level event based on what we have seen so far.",6
1776y29,k4sg0wl,Isn't that just Andy?,6
1776y29,k4t75qi,Feel free to drop it if it gets a bit too high iq for you to handle,7
176zqnz,k4pks0g,"And the winner of the first 6-way war between JJK, Eminence, Frieren, Undead Unluck, 100 Girlfriends and Spy x Family is...Kingdoms of Ruin.

You gotta love Anime Corner.  Also, for anyone who watched it, was Kingdoms of Ruin deserving of its surprise #1 ranking?",0
176zqnz,k4ppy7t,"Now that's the kind of ""Go home, Anime Corner, you're drunk"" result that I'm looking for.  I have heard nothing about *The Kingdoms of Ruin*, so I have no idea how to react.  Hidden gem?  Crime against taste?  I have no idea.",0
176zqnz,k4pk41r,"100 Girlfriends is pretty high up great to see

Damn Frieren dropped a bit :(",0
176zqnz,k4pr527,"Let's go, Undead Unluck is top 5! Hope it stays like this because the manga is so good and deserves to be popular.",0
176zqnz,k4pkxzh,lol kingdom of ruin at \#1,0
176zqnz,k4pqynq,"I absolutely love **16bit Sensation**, but I guess Anime Corner is not the target audience.",0
176zqnz,k4ptti4,"Man, Shangri-la Frontier dropped off the chart. I hope Anime Corner is not sleeping on this show, cause it's got amazing production and watching it is just pure fun.

Then again, Anime Corner *is* chaotic lol.",0
176zqnz,k4pmslc,"Lmao Kingdoms of Ruin at #1.  Frieren at #4, HyakuKano and SxF2 entering at 6 and 7.  This craziness right here.  This is why we follow AC",0
176zqnz,k4pl87p,"Did not see this #1 coming, wow.

I enjoyed the first episode, couldn't deny that this was a strong hook for me and it makes me root for the MC's actions that will follow the events of episode 1, quite possibly in today's episode already.",0
176zqnz,k4pq1ie,Kingdoms of Ruin is the one new show that I was interested in that I haven’t gotten around to watching the first episode yet. May have to prioritize checking it out now that it seems to be getting a good reception.,0
176zqnz,k4pyvdg,Holy shit new Dr Stone dropped? Oh yeaaaaaaaaaah,0
176zqnz,k4prtwi,Let’s go undead unluck getting the amount of attention it deserves,0
176zqnz,k4px55e,"This is why I follow this, I didnt know any of these came out",0
176zqnz,k4qy2u5,"These lesser appreciated series need some love:

* Ron Kamonohashi’s Forbidden Deductions
* The Saint’s Magic Power is Omnipotent
* Tearmoon Empire
* 16bit Sensation",0
176zqnz,k4q19vy,"What the hell is Kingdom of Ruin? Literally never heard of this. Must be fire to beat all the best shows of the season. 

It’s too low for my liking so I’ll gas it up: 100 Girlfirends Who Really Really Really Really Really Love You isn’t the funniest show of the season. It’s the funniest show of the year. The premise on its face doesn’t fully convey just how fucking bonkers this thing is. Watch the first episode. You will convert. And they’re just getting started.",0
176zqnz,k4q1542,WHERE IS SHANGRI-LA FRONTIER? I DEMAND A RECOUNT.,0
176zqnz,k4pluam,"From all of these, that shit KoR is #1? People have fallen onto a hammer and went stupid this week.",0
176zqnz,k4psoee,Does animecorner just pick these at random?,0
176zqnz,k4pktxd,The Kingdoms of Jujutsu Eminence Beyond Undead Girlfriends season 2.5 Crimson edition,0
176zqnz,k4plhhr,"> kingdom of ruins at #1


Thanks for the meal, animecorner! thats exactly why we love you.

Since its already on my ptw list, this is probably the sign to watch it...but the last thing I need right now is MORE shows.

NICE Undead Unluck made it into the Top 5!! David productions but with SHAFT direction made for a fantastic first episode. Then I'll even accept it temporarily denying 100kanojo acces to the top 5. But its inescapable
> tearmoon empire down at #32

Deep breaths. Okay the trailers were kinda terrible as they didnt really show off what makes the show so fun-hell, despite being really fucking great, neither did the first episode. Please trust me and watch it anyway. It actually has a lot of similarities with eminence, with a main character that bullshits herself through life for selfish reasons but somehow always ends up being right, and then gets sasuga'd.",0
176zqnz,k4qeexo,Is Eminence in Shadow good? I keep seeing stuff about it but I can’t find where to watch it,0
176zqnz,k4qjtm0,"Rentarous family, you know what to do. We gotta bump those numbers up",0
176zqnz,k4pncy5,Can’t believe the kingdoms of ruin made #1. I guess edge really does sell.,0
176zqnz,k4qvrr2,100 girlfriends LETS FUCKING GOOO,0
176zqnz,k4r5fip,"Frieren nr 1 for me. But, man I don't get the hate for nr.1. I love my overly edgy stupid shows. Just action and insane people doing insane things.",0
176zqnz,k4poz5g,"Man, Anime Corner's tastes are messed lol",0
176zqnz,k4q53xp,No villainess anime on this list? Whyyyyyyy? :(,0
176zqnz,k4pqnts,That's a really interesting result. Maybe Kingdoms of Ruin is such a sleeper hit/dark horse?,0
176zqnz,k4prduw,"Wait #1 is the first time I'm hearing of it, is it good show or troll votes?",0
176zqnz,k4qq7xy,Undead Unluck doing well? Sick! Wicked Sick!,0
176zqnz,k4qjhhr,Sad that MF Ghost isn't in here,0
176zqnz,k4qomai,"I might be the only one here sad to not see Tokyo Revengers up here...

Ik people don't agree but I think it's really good, and Takemichi isn't even bad like people play him up to be",0
176zqnz,k4r5xpe,Spy x Family. That's my show!,0
176zqnz,k4pki7n,The Kingdoms of Ruin is good? Didn't see any hype about show before  season started.,0
176zqnz,k4q6xi2,Cid appeared in the top 3 just to tell us that the moon is red.,0
176zqnz,k4pum0n,I really wanna watch undead unluck but its not available in my country 😭 its been years no since yuichi nakamura voiced the mc ?,0
176zqnz,k4q18ve,Frieren doesn't feel much entertaining yet I am watching it for some reason,0
176zqnz,k4qxlsr,is the new season of shield hero worth watching. i cba to watch it tbh,0
176zqnz,k4r4m4r,"Under Ninja needs love man. Can't decide if it's funny and stupid, or something really serious brewing.",0
176zqnz,k4r6uac,"HUHH? Barely anything happened in episode 1 of Kingdoms of Ruin for it to get that high of a rating lol

And being a manga reader, the anime adaptaiton isnt really looking like it's gonna turn out so great",0
176zqnz,k4rxpqv,"I like their top 10 during the spring this year when the romcoms were dominating their charts. Since then I've much preferred this sub's karma ranking. I dunno I think they have bad taste, but to be fair I'm probably the one with bad taste lol! 😅",0
176zqnz,k4q6dzk,"I wonder why does community of a subreddit loving edgy series like Akame ga Kill, Made in Abyss, Attack on Titan, Classroom of the Elite, Chainsawman, Blue Lock, Goblin Slayer dislike the #1 so much.",0
176zqnz,k4pu4n5,"kingdom of ruin was the worst sh*t i have seen lately, how is this number 1?",0
176zqnz,k4q2yd0,"Bruh, no shot Kingdom of Ruin is on top lmao. I'm giving it a shot, but that first episode was way too fucking edgy lmao.",0
176zqnz,k4q5ite,The episode of the rising of the shield hero was actually really good. It reminded me a lot of S1.,0
176zqnz,k4s24pr,100 GF NATION 🔥🔥🔥✍️,0
176zqnz,k4qla41,Nah Frieren not being #1 is wild,0
176zqnz,k4pvz1t,Nice. Well deserved 1st place. Easily better than other anime from top 5.,0
176zqnz,k4qagwa,Wasn’t expecting that.,0
176zqnz,k4qd95o,"JJK supremacy, MAPPA is doing a great job",0
176zqnz,k4qoiq1,WHERE DO ALL OF THESE TRASH FANTASY ANIME COME FROM?!,0
176zqnz,k4r05dd,"I'm telling ya'll, Anime Corner lists are garbage, it's only 10k votes, and I'm sure it's botted as well.",0
176zqnz,k4q7r5o,is kingdoms of ruin and rising of hsield hero season 3 good,0
176zqnz,k4rfef0,"Run, if you value your life. The frenzy has begun. The moon is red. We're out of time.",0
176zqnz,k4rgz8h,The moon is red,0
176zqnz,k4pod60,KoR actually great idk where all these haters came from.,0
176zqnz,k4pw2j3,Why are young South East Asians so enamored by Isekai and/or isekai/gamer like fantasy?,0
176zqnz,k4qlc9e,This honestly made me laugh hard.,0
176zqnz,k4qzrog,Sousou no Frieren is the falls best anime,0
176zqnz,k4r5lmd,"As per usual, find the Anime Corner list and then watch the opposite of that.",0
176zqnz,k4s7r7h,"Shield Hero should be higher in the list, we got a serious upgrade compared to season 2",0
176zqnz,k4s15xp,People still watching The Shit in Shadow should leave their rooms at some point in life 💀,0
176zqnz,k4psf0p,Huh,0
176zqnz,k4q49qf,"Damn, I expected to see Undead Girl Murder Farce. Sighhh….",0
176zqnz,k4pqyub,Professional larper Cid and Eminence in Shadow in the top 5. Yikes.,0
176zqnz,k4puof0,Where can I watch the shows that aren't on crunchyroll,0
176zqnz,k4q0h5l,Didn't even know Dr Stone came back lol,0
176zqnz,k4q2ll5,"Fast drop for Frieren. It will probably go higher again because of the epic fight scene in episode 6, after that it might stay in the middle.",0
176zqnz,k4q4bjl,"Such a shame ""dark gathering"" didn't make in the chart. Its most recent episode was really well made, with a creepy atmosphere which was spot on.

Helck also had a really good episode this week.",0
176zqnz,k4q8jdo,I never even heard of the one at the top,0
176zqnz,k4qbfx7,Never heard of the #1 lmao ok guess i gotta check out,0
176zqnz,k4qhdd2,I’m watching 15 shows this season so far and somehow only 2 are on this list.,0
176zqnz,k4qli57,Is Ragna Crimson valid?,0
176zqnz,k4qoruw,"LESS FUCKING GOOO UNDEAD UNLUCK, DR STONE, JUJUTSUKAISEN, SPY X FAMILY, AND EMINENCE IN SHADOW ALL IN THE TOO 10!! man we are eating good this season.

I'm so haply undead unluck has been so loved, it was one my favorite manga and I have followed it for years, it's great to see it popping off",0
176zqnz,k4qpdco,I thought ragna crimson would be doing better bummwr,0
176zqnz,k4qxdqh,Should I watch kingdom of ruin?,0
176zqnz,k4r3keh,"From the seasonal series i watch, 4,5,9 and 10 are in my list.",0
176zqnz,k4r5o8c,Sad that Shangrila Frontier aint getting any buzz,0
176zqnz,k4rbzla,Wtf lord shadow 3rd no why,0
176zqnz,k4rck1m,"The ""x5"" really made me laugh",0
176zqnz,k4riz4z,Sees number 5 RAGES IN JEALOUS AUSSIE!,0
176zqnz,k4rjcux,"Frieren has a chokehold on me, I teared up while watching the first episode. It does something to me.",0
176zqnz,k4rjlx3,"The kingdoms of ruin is actually a slapper so far. I never knew about the manga. Being completely blind, it is so good.",0
176zqnz,k4rjypz,Frieren got done dirty,0
176zqnz,k4rmsxi,YES UNDEAD UNLUCK DOING GOOD?!,0
176zqnz,k4rn7em,Oh this will be interesting to see once the weeks develop. I read and found Kingdoms of Ruin having an explosive start and then... It just fizzled out.,0
176zqnz,k4rpkru,I think mf ghost shows promise at being really good,0
176zqnz,k4rws8t,Would yall give kingdoms of ruins a recommend? I’ve been looking for new anime to watch. And a new face being over jjk who is dominating right now is very surprising.,0
176zqnz,k4s1ayi,JJK stay winning🗣🗣🗣,0
176zqnz,k4s5rc1,"I read the kingdom of ruins manga but even i’m surprised it got here. Will drop slowly though, the rest of the series isn’t as good as the beginning.",0
176zqnz,k4s69sk,Goblin slayer season 2 should be up there,0
176zqnz,k4s9jaj,"I’m watching number 10 right now, it’s pretty good, my friend has been trying to get me to watch jujutsu thought.",0
176zqnz,k4s9p7i,Is the kingdoms of ruin good? I never heard of it before and now it’s first. Should I watch it?,0
176zqnz,k4sbnh3,Undead is only 5?,0
176zqnz,k4sbyzw,"spy x family shouldnt be even be on this list but alright. #7, still sucks as per usual omll",0
176zqnz,k4sfx7j,"I skimmed through episode 1 of kingdoms as it was painfully edgy in hopes the next would tone into down, and the fight when he gets out is so bleh I just dropped it. Like it just was bad",0
176zqnz,k4sgspv,Dr stone is always criminally underrated every season it drops. Kind of sad :/,0
176zqnz,k4skuss,What's The Kingdoms of Ruin on?,0
176zqnz,k4sm6lt,Nanamin single-handedly keeping JJK at #2 on a build up episode.,0
176zqnz,k4sp3m1,SHIELD HERO IN THE TOP 10 WE ARE SO BACK,0
176zqnz,k4srpko,"6 seriously? Then why girlfriend, girlfriend isnt in the list...wait ik instead a guy three timing ,it's better 100 timing XD. But stil I think Shangri la frontier and that the deducing guy anime ,I forgor the anime ,but it's better than 6.",0
176zqnz,k4sy4jx,"This season seems to be very competitive when the #1 of the week has only 6%. 

Bet Kingdom of Ruins won't make it in the top 5 next week.",0
176zqnz,k4t33dk,The only ones I’m familiar with here are JJK and Spy X Family. Are any of the other ones worth watching?,0
176zqnz,k4t7foe,Where can I watch undead unlock?,0
176zqnz,k4t7v4j,I need to start spy family,0
176zqnz,k4tds2n,"For those who want to stream UxU, I think it's on disney+ on asia.",0
176zqnz,k4tegj2,"Ive only heard of JJK and Spy x Family

What the fuck is going on in #6 tho???",0
176zqnz,k4tf2ps,yo where is the love for under ninja?,0
176zqnz,k4tfm12,"Kingdom of Ruin is very mid, it uses shock factor and edginess to shock you, nothing else. The animation, aside from very short shots, is mediocre. They freaking use still shots to ""animate"" a golem moving, wtf.",0
176zqnz,k4tfpnm,"I'm happy for 100 Girlfriends, and hopefully it will rise to the top 5",0
176zqnz,k4pliw1,It was a VERY dramatic opening to a tragedy anime. I tried the first episode from which I found myself wanting more so I read the manga then… I dropped it. This is the sort of story where there doesn’t seem to be a natural barrier or boundary to all the deaths and destruction occurring in the manga EVEN for a dystopian and oppressive society.,1
176zqnz,k4pl5xs,"> was Kingdoms of Ruin deserving of its surprise #1 ranking?

Maybe as something to watch along with friends and laugh at the amount of edge",1
176zqnz,k4pxjx7,It seems okay so far but the reason for the story (hunting witches) is pretty fucking stupid. I’m hoping there’s more to it.,1
176zqnz,k4q1565,"If you want to watch a no-holds barred revenge story, probably. 

I’m an anime-only, so no idea how it goes in the manga, but I’m sure atleast the revenge scenes will be cathartic if anything lol",1
